0,Musik,"Das Außerhalb ist ein temporärer Ort für Musik, Kunst und Kultur unter freiem Himmel. Ein Treffpunkt für die Vagabunden, Überlebenskünstlerinnen und Träumer Bremens. Ein Raum für Projekte und ein Kleinod für 
Inspiration.",Außerhalb-Kollektiv,Bremen,2.500 €,8.000 €,"Recht auf Stadt, Festival, Musik, Subkultur, Kultur",Seit 2012 sind wir als ,Wir wollen wieder ein ,Kilian Chaunière Paul Kothé
0,Umwelt,"Mit jedem Einkauf etwas für sich selbst und seine Gesundheit tun und die Welt dabei ein kleines Stückchen besser machen - das könnt ihr bald bei Frau Ernas losem LebensMittelPunkt. 
 Hier gibt es - wie früher im Tante Emma Laden - alles lose. Vom Müsli über Getreide und Kaffee, bis hin zu den passenden Behältern und auch Hygieneartikel.",Frau Ernas Team,Magdeburg,13.031 €,31.013 €,"plastikfrei, nachhaltig, Müllvermeidung, Weltretten, Unverpackt","Es geht um die Gründung eines Unverpackt- oder ""Tante Emma
Ladens 2.0"" ;)","Bei uns im Laden sind alle willkommen: junge Weltverbesserer
genauso wie Menschen, die einfach nur genervt sind von schwer zu
öffnenden und unnötigen Verpackungen. Auch jene, die sich nach
der Rückkehr des altbekannten Tante-Emma-Ladens sehnen, werden bei
Frau Ernas losem LebensMittelPunkt etwas wiederfinden, das es in
unserer heutigen Gesellschaft zu wenig gibt: Zeit und Charakter.
Bei uns im Laden wird der Einkauf wieder zum Erlebnis. Hier ist man
näher am Produkt, näher am Menschen – Persönlichkeit und
Entschleunigung statt Anonymität und Hektik.",Sarah Werner Frithjof
0,Musik,"...uuund START! Wir sind die Punkrock Band Bouncin B.C. aus Niederbayern! Nach 5 Jahren mit diversen Touren im In- und Ausland, Besetzungswechseln, Konzerten mit tollen Leuten (vor, hinter und auf der Bühne), musikalischer Entwicklung und unserem mittlerweile 10-jährigen Bestehen soll das Projekt Bouncin B.C. jetzt nochmal richtig starten! 
Um diesen Traum zu realisieren, brauchen wir Eure Unterstützung, damit das neue und bereits überfällige Album produziert werden kann!",Ferdinand Haimerl,Landshut,3.000 €,,"Ska, hardcore, Bouncin B.C., Rock, Punk","Es geht um die Realisierung des neuen Albums von Bouncin B.C.
nach einer langen Zeit ohne neuer Musik und zum 10-jährigen
Bandbestehen.","Es ist unser innigster Wunsch und nun festes Vorhaben, unsere
neue Musik endlich für unsere Fans, unsere Unterstützer, Freunde
und Familien, sowie auch für uns selbst zugänglich zu machen.",Ferdinand Haimerl
0,Fotografie,"Alles nur Grau in der Stadt? 
Stimmt gar nicht! 
WIENER WILDNIS ist ein Buch, das anhand von einzigartigen Fotos und Texten auf die überraschend vielfältige Natur in der Großstadt aufmerksam macht. Es geht um die unterschätzte Bedeutung urbaner Räume als Zufluchtsort für Wildtiere. Aber auch um die zunehmend positive Wirkung urbaner Wildnis auf uns Menschen. Ein innovatives, einzigartiges und zugleich hochwertiges Buch zum Lesen und zum Staunen. 
Garantierte Auslieferung im November 2017.",Verena & Georg,Wien,10.000 €,30.000 €,"Umwelt, Buch, Urbane Natur, Fotografie, Tiere","WIENER WILDNIS wurde im Jahr 2012 vorwiegend für digitale
Medien ins Leben gerufen. Am Beginn stand ein fotografisch gesehen
""leeres Blatt"", weil es diese Thema bis dato noch gar nicht gab.
Mit viel Geduld, Recherche und technischen Aufwand, gelangen uns im
Lauf der Zeit noch nie dagewesene Bilder von Säugetieren, seltenen
Vögeln, Kleintieren oder Insekten aber auch Pflanzen mitten in
Wien. Selbst die städtische Unterwasserwelt wurde von uns
spektakulär in Szene gesetzt. Seit dem Start 2012 begeistern und
überraschen die Fotografien der wilden Wiener Tierwelt eine stetig
wachsende Fangemeinde auf Facebook sowie die Besucher unserer
Vorträge.","WIENER WILDNIS - ist sowohl in inhaltlicher als auch visueller
Hinsicht ein einzigartiges Buch und daher für eine große
Zielgruppe geeignet. Jeder der sich für eine oder mehrere der
folgenden Themen interessiert, wird von unserem Buch begeistert
sein:",Georg Popp Verena Popp-Hackner
0,Film  Video,"Ein Coming-of-Age Film, in dessen Zentrum vier junge Frauen stehen. Er erzählt von einer Freundschaft, die grenzenlos erscheint. 
Doch durch eine Entscheidung sind sie plötzlich mit der Endlichkeit der Freundschaft konfrontiert. Dennoch ist Liebe auch das, was am schwersten fällt, loszulassen. 
Vier starke, unabhängige Charaktere, die losgelöst von einer Feminismus Debatte davon erzählen, warum der Mensch weder alleine sein kann noch auf Dauer kompromissfähig ist.",Vier,Berlin,2.700 €,,,"Die vier Freundinnen Charlotte, Clara, Naïma und Sophia kennen
sich schon seit der Schule. Doch nun, wo die Schule vorbei ist,
entwickelt jede ihre eigenen Vorstellungen einer Zukunft.
Gleichzeitig klammern sie sich in dieser Strukturlosigkeit umso
mehr aneinander. Die Freundschaft, die die vier miteinander
verbindet ist sehr innig, beinahe schon familiär. Eine
Kindheitsliebe, die bis zu diesem Zeitpunkt nie in Frage gestellt
worden ist. Trotz der freundschaftlichen Harmonie unterscheiden
sich die vier Mädchen in ihrem Wesen, ihren Wünschen und
Problemen stark voneinander. Naïma, die Probleme hat, alleine zu
sein, aber zugleich eine Unabhängigkeit anstrebt. Charlotte, die
ein wenig naiv auf der Suche nach Liebe ist. Sophia, die hin- und
hergerissen ist, zwischen dem, was sie glaubt zu wollen und
wirklich will. Und zuletzt Clara, deren größte Angst
Veränderungen sind und die trotzdem die Entscheidung trifft, aus
Berlin wegzugehen. Damit steht mit einem Mal die Endlichkeit ihrer
Freundschaft im Raum und die letzten gemeinsamen Wochen entwickeln
sich anders als anfänglich erhofft.","„Vier“ soll ein Coming-Of-Age Film werden, der eine enge
Freundschaft von jungen Frauen darstellt, die nicht stereotypisiert
werden oder eindimensional als Nebenfiguren auftreten. Anders als
bei vielen anderen Filmen mit weiblichen Hauptrollen setzen sich
hier die Vier nicht mit ihrer Rolle als Frau in der Gesellschaft
auseinander, sondern agieren losgelöst davon. Daher stellt der
Film auch keine Frage nach einer weiblichen Identität, sondern
thematisiert eine Freundschaft, die allen Geschlechtern auf gleiche
Weise zugänglich ist. Zudem behandelt der Film keine typischen
Jugendfilm-Thematiken wie Drogen, die Suche nach der eigenen
sexuellen Identität oder Perspektivlosigkeit nach der Schule.
Vielmehr steht im Mittelpunkt die Schwierigkeit der Gutgläubigkeit
der Kindheit und der des Zweifels des Erwachsen-Werdens, die Angst
und gleichzeitig der Drang nach Veränderung, die Frage nach
Unabhängigkeit und Abhängigkeit und die Erkenntnis von
Endlichkeit, die mit einem Mal überall zu spüren ist.",Clara Baro Naima Sita Walter Lorenz Willkomm Sophia Havanna Picabia Huth Charlotte Lau
0,Musik,"40 Jahre Punk! 
In Stuttgart!? Ja! Unter der spießig-glatten Oberfläche der baden-württembergischen Landeshauptstadt brodelt(e) es. Der Historiker und Musiker Simon Steiner hat über 100 Zeitzeugen-Interviews geführt, unendlich viele Fanzines, Kassetten, Platten, Klamotten, Fotos, Plakate... gesammelt. Wie kam es zu einer Punkbewegung? Wo ging sie hin? In einer Stadt, bekannt für Kehrwoche, Autos, HipHop und Feinstaub. All das erlebbar in einer Buchpublikation, auf Tonträgern und Ausstellung.",stuttgartpunk,Stuttgart,14.300 €,,"Punk, Stuttgart, Buch, Doppelalbum, Ausstellung","Wie Simon Steiner im Projekt-Trailer (klick ""Video abspielen"")
erläutert hat: Es geht um Punk in Stuttgart. Wie er herkam, wo er
hinging. Reingepackt in:"," bei dieser Crowdfunding-Aktion ist, dass
wir Dich/Euch von diesem Projekt begeistern können, und
somit…",Uli Schwinge Shanthi Schwinge Barny Trouble Simon Steiner
0,Community,"Mit eurer Unterstützung möchte ich ein mild formuliertes Gesichtswasser auf den Markt bringen und später in meinem eigenen Onlineshop vertreiben. Die Rohstoffe hierfür stammen aus der EU, es ist vegan, tierversuchsfrei, wird 100 ml beinhalten und in einem Zerstäuber aus Braunglas abgefüllt. So sind die Inhaltsstoffe besser geschützt.",Eugenia Garder,Dresden,6.000 €,,"hautpflege, kosmetik","In diesem Projekt geht es darum mein geliebtes DIY
Gesichtswasser verkaufstauglich zu machen. Der Hersteller ist in
Deutschland ansässig und wird das Gesichtswasser nicht nur
herstellen, sondern auch abfüllen und etikettieren.","Mein Ziel ist es mindestens 500 Flaschen a 100 ml des Wassers
herstellen zu lassen und für Hautpflegebegeisterte, Allergiker und
Leute mit Problemhaut anzubieten. ",Eugenia Garder
0,Theater,"Die BaroqueBitches mögen es besonders! Mit der Show ""Time Travel Bitches - BaroqueBitches On The Road"" bringt das Barock-Performance-Duo, zusammen mit einem großartigen Akkordeonisten, Oper an besondere Orte. Ob Bar oder Badewanne - hier gibt es klassische Musik für jeden und garantiert ohne Sicherheitsabstand. Um die Premiere am 5. Mai 2017 in Berlin finanzieren zu können, brauchen die BaroqueBitches Deine Hilfe!",BaroqueBitches,Berlin,500 €,1.370 €,"Strassenmusik, Akkordeon, Oper, Barock, Pop Up Opera","Die BaroqueBitches wollen ihre eigene Show! Nach viel
Straßenmusik und zahlreichen, kleineren Performances soll endlich
expandiert werden, denn: auch eine BaroqueBitch muss sich stets
weiter entwickeln.","Unsere Berufung ist es, Oper an Orte zu bringen, an denen sie
nie zuvor erklungen ist und somit ein neues Publikum für Oper zu
gewinnen. Ob Flüchtlingscamp oder Festival, ob Bar oder Badewanne
- wir bieten an jedem Ort und jedem die Möglichkeit, klassische
Musik ganz ohne Zwang zu erleben.",Nicole Kronwitter geb. Tschaikin Nicole Tschaikin Claudia Roick Dennis Weijers
0,Fotografie,"Mit diesem Kalender voll mit einzigartigen Looks, Burlesque inspirierter Optik, und elegantem Design möchte ich mir endlich einen lange gehegten Traum erfüllen! In 14 Motiven (1 Cover, 1 Editorial und 12 Monate) möchte ich mich optisch austoben, kreativ weiterentwickeln und zeigen, dass es für herausragende Arbeit im kreativen Bereich nicht mehr als einen offenen Geist braucht... und eure Unterstützung!",Dita Whip,Freiburg im Breisgau,500 €,,"Vintage, Design, Fotografie, Drag Queen, Kalender", - Wir wollen euch nicht nur ,Das ,Dita Whip
0,Theater,"Die Leopoldschule (www.leopoldschule.at) im zweiten Wiener Gemeindebezirk ist inklusives, kreatives Lernambiente für rund 130 Kinder aus 22 Nationen, mit und ohne Behinderung. Nach dem großen Erfolg der Musiktheaterversion von „Valerie und die Gute-Nacht-Schaukel“ im Jahr 2014 nehmen die Schüler_innen unter der Leitung von Agnes Palmisano nun eine neue Theaterproduktion in Angriff: Am 31. Mai 2017 bringen sie den Kinderbuchklassiker „Dschungelbuch“ als Musical auf die Bühne des Wiener „MuTh“.",Das Dschungelbuch,Wien,3.000 €,,"Theater, Inklusion, Musical, Kindermusical, Kindertheater","Das „Dschungelbuch“ ist mehr als ein uns allen bekannter
Zeichentrickfilm. Rudyard Kipling hat mit der Geschichte um den
kleinen Jungen Mowgli, der bei den Tieren des Dschungels
aufwächst, vor 100 Jahren ein Stück Weltliteratur geschrieben.
Agnes Palmisano und Helmut Stippich haben daraus ein Musical für
Kinder gemacht. Gefühlvolle Balladen, Rock und Rap bilden ein
abwechslungsreiches, harmonisches Ganzes. Solisten, Chor und Tanz
– alle bringen sich begeistert und engagiert ein und machen das
Dschungelbuch-Musical zu einem bunten Theaterereignis.","Die Aufführungen sind für alle Menschen ab 3 Jahren sicherlich
ein ergreifendes Erlebnis. Bei den Dankeschöns gibt es auch einige
für Menschen, die es nicht zu den Aufführungen schaffen
werden.",Lisa Schmidt
0,Community,"Unter fachkundiger Betreuung ein klassisches Boot restaurieren - 
im Sommer auf einem der berühmtesten kleinen Traditionssegler Deutschlands durch die See kreuzen. 
Mit dem Projekt „Timpe Te zur See - Jugend restauriert Film-Boot“ sollen junge Menschen genau das erleben.",Team „Timpe Te“,Flensburg,5.000 €,7.000 €,"Timpe Te, Dulcibella, Segeln, Restaurierung, Jugendarbeit","Die Timpe Te, das als „Dulcibella“ bekannte Boot aus dem
Film „Das Rätsel der Sandbank“, wird wieder fit fürs Wasser
gemacht. In einem professionell angeleiteten und durch Fachkräfte
unterstützten Jugendprojekt wird das Boot instand gesetzt. Danach
steht das historische Boot in Flensburg jungen Leuten zum Segeln
zur Verfügung.","Ziel des Projektes ist es, der Timpe Te ein neues Leben auf dem
Wasser zu schenken. Junge Menschen sammeln dabei Erfahrung im
Bootsbau und in der Instandsetzung von Holzbooten und entwickeln
nicht zuletzt soziale und organisatorische Kompetenzen. Ein
fertiges Gemeinschaftsboot für Jugendliche bringt dann Freude und
Erfahrung beim Segeln mit klassischer Takelung. Zielgruppe sind vor
allem Jungen und Mädchen im Alter von 14 Jahren bis ins frühe
Erwachsenenalter, die neben dem trockenen Schul- und Arbeitsalltag
Interesse am Kennenlernen der maritimen handwerklichen Welt
haben.",Daniela Friedrich David Friedrich
0,Theater,"„UWE – der Festival“ ist das internationale studentische Theaterfestival von uns Studierenden der Theaterakademie August Everding. 
Vom 25. - 28. Mai 2017 verwandelt sich die Akademie in ein Festivalzentrum und lädt alle Theaterbegeisterten dazu ein, 14 studentische Produktionen von Schauspiel über Performance und Tanz aus Deutschland und Europa zu erleben und zu diskutieren. UWE steht für Experimentierfreude und bietet eine Plattform für studentische Theaterkultur mit professionellem Anspruch.",Uwe Undseinteam,München,750 €,,"Theaterfestival, Performance, Studentisch, Festival, Theater","An vier Tagen wollen wir unterschiedlichste Theaterproduktionen
von Studierenden aus dem deutschsprachigen Raum und aus ganz Europa
präsentieren und diskutieren. UWE will keine inhaltlichen und
ästhetischen Einschränkungen: Egal ob Performance, Tanz,
Schauspiel, Musiktheater, Puppentheater oder ganze neue Formen des
Theaters - ihm sind alle Ästhetiken und Formen willkommen, nur
studentisch muss es sein! UWE wendet sich an
Nachwuchskünstler*innen sowie an alle Theaterbegeisterte, die mit
Enthusiasmus das zukünftige Theater mitgestalten, diskutierten und
hinterfragen wollen. UWE ermöglicht den Diskurs, denn der
künstlerische Austausch untereinander und mit dem Publikum ist
unser größtes Anliegen. Wir wollen zeigen, wie das Theater von
morgen aussieht, wofür junge Theaterschaffende brennen, welche
Themen, Ästhetiken und Formen sie interessieren und gemeinsam mit
dem Publikum darüber diskutieren!","Das Festival richtet sich an ein junges Publikum und
Studierende, an Nachwuchskünstler*innen und an alle
Theaterbegeisterten!",Uwe Undseinteam
0,Mode,"Organisch ist nicht gleich organisch. Die meisten Gifte stecken in der Färbung! Darum sollte organische Bekleidung vom Anbau bis zur Färbung natürlich sein. Die MARGA Produkte bestehen aus 100% GOTS Bio-Baumwolle und werden 100% mit natürlicher Farbe, wie z.B. den Pigmenten der Indigo-Pflanze oder etwa Kräutern etc. gefärbt. Eine 100% natürliche Färbung ist in diesem Markt einzigartig. Die Produkte sind frei von Pestiziden, Herbiziden, Synthetischer Farbe.  
www.mariomarga.com",MARGA Team,Aalen,4.000 €,12.000 €,"Organisch, Bio, Mode, fair, natürlich","Das Ziel ist es so natürlich, fair und umweltbewusst wie nur
möglich zu produzieren. Vom organischen Anbau der GOTS
Bio-Baumwolle bis hin zur einzigartigen natürlichen Färbung von
Hand werden keinerlei giftige Stoffe verwendet. Wir möchten eben
organische Kleidung auch organisch sein lassen!","Unsere Produkte zielen auf die Menschen ab, die dabei helfen
wollen die Verpestung durch synthetische Färbung zu stoppen und
ihren eigenen Körper durch reine Bekleidung nicht zusätzlich mit
Giften belasten zu wollen.",Mario Margarone
0,Musik,"Ich möchte mit meinen Liedern Menschen aller Kulturen und Religionen die Botschaft einer weltumspannenden Verbundenheit vermitteln und durch die Vielfalt der Sprachen meiner Lieder auf jiddisch, deutsch, ungarisch, griechisch und Liedern der Roma einen Beitrag zur Völkerverständigung leisten, was in diesen unruhigen und kriegerischen Zeiten, wo so viele Menschen verschiedenster Nationalitäten zu uns kommen, für mich ein besonderes Anliegen ist.",Sibylle Kynast,Stuhr,4.500 €,,"Jiddisch, Deutsch, Weltmusik, Spanisch, Roma Lieder","Mit Eurer Hilfe werde ich mit meinem Ensemble in den
Thein-Studios unser 3. Album aufnehmen mit dem jiddischen Titel:
„Lomir sich iberbetn, Lass uns versöhnen“. Neben jiddischen
werden auch deutsche, griechische, ungarische, serbische, russische
und Lieder der Roma erklingen","Ich möchte mit meinen Liedern Menschen aller Kulturen und
Religionen die Botschaft einer weltumspannenden Verbundenheit
vermitteln und durch die Vielfalt der Sprachen meiner Lieder einen
Beitrag zur Völkerverständigung leisten, was in diesen unruhigen
und kriegerischen Zeiten, wo so viele Menschen verschiedenster
Nationalitäten zu uns kommen, für mich ein besonderes Anliegen
ist.",Sibylle Kynast
0,Food,"Leckerer Kaffee und ausgefallene Süßspeisen, ein Filmabend in gemütlicher Atmosphäre, interessante Themenabende, ein entspannender Yoga-Kurs oder am Abend ein Glas Wein. Sei unser Gast im Pfotenreich-Café und genieße all das in feliner Gesellschaft, - denn mit Katzen ist alles viel schöner!",Pfotenreich Café,Frankfurt am Main,35.000 €,,"Katzen, Tiere, Frankfurt, Café",Ein Katzencafé für unsere wundervolle Stadt ,"Wir möchten unseren Katzen ein eigenes Reich schaffen, in dem
sie sich frei und maximal wohl fühlen. Für einen
abwechslungsreichen Alltag sorgen unsere lieben Gäste mit ihren
Streicheleinheiten und jeder Menge abwechslungsreicher
Spielangebote. ",Angelique Bauer Stergios Papagiannis
0,Food,"reCIRCLE ist ein Mehrwegsystem für Restaurants, die Takeaway-Food anbieten. Die Idee basiert auf einem Gemeinschaftsgedanken: Das reCIRCLE Netzwerk wird umso schneller wachsen, je mehr Menschen die reBOX nutzen - Die wiederverwendbaren ReBoxen schonen nicht nur die Umwelt, sondern ermöglichen auch einen schadstofffreien Transport. 
 Das Mehrwegsystem wurde 2014-2015 in Bern mit 12 Restaurants erfolgreich etabliert und soll nun in einer Pilotphase in Stuttgart getestet werden.",Mehrweg Initiative Stuttgart,Stuttgart,2.000 €,7.000 €,"reCIRCLE, Pfandsystem, Takeaway, Mehrweg, plastikfrei","reCIRCLE soll dir und der Umwelt Freude machen. Du kannst deine
Essensverpackung beim reTakeaway jederzeit frei wählen. Mit deiner
reBOX und deinem reBECHER bist du immer frei: Behalte sie, tausche
sie, sammle sie, gib sie einfach zurück.","Wir wollen in einer sauberen und verpackungsmüllfreien Stadt
leben. Unser nachhaltiges reSystem bildet dafür einen wichtigen
Grundstein. Unsere Zielgruppe sind daher alle Fans von
Takeaway-Food in Stuttgart, die durch die Nutzung unserer
schadstofffreien reBoxen einen großen Beitrag leisten.",Matthias Traut dari Diana Bereczky Liane Preuß Jonas Umgelter Maria Pinsker Tobias Kruschhausen Thorben Bechtoldt Manuel Lorenz
0,Literatur,"Zum 75. Geburtstag von Daniel Roth wird Ende Oktober eine Festschrift erscheinen: Licht im Dunkel – Lumière dans les ténèbres. 
Schriftleiter ist Prof. Dr. Birger Petersen von der Universität Mainz; das Buch erscheint im Butz-Verlag, Bonn.",Michael Grüber,Horb am Neckar,10.000 €,,"Festschrift, Orgel, Daniel Roth, Saint Sulpice, Organ"," sagt Daniel Roth 2009 in einem Interview auf der
Orgeltribüne von Saint Sulpice.","Mit der Festschrift soll einer der großen Organisten unserer
Zeit geehrt werden.",Michael Grüber
0,Technologie,"Lass uns das Laden erleichtern! TK-Connections ist eine einfache, aber dennoch perfekte Lösung, um ausgefranste Ladekabel zu vermeiden, über das Kabel zu stoßen, was zu zerschlagenen Smartphones führt, sinnloses Fummeln, um das Kabel im Dunkeln zu stecken, Wasserschaden durch Ladestation und vieles mehr! Dieser innovative magnetische Ladeadapter macht Ihr Leben einfach etwas bequemer.",TK-Connections,Zürich,25.000 €,,"android, iPhone, Ladeadapter, Micro-USB, Lightning","Kein umständliches Gefummel mit Steckern und Kabeln mehr: Jetzt
laden Sie Smartphone und Tablet-PC magnetisch! Docken Sie Ihr
Mobilgerät einfach an Ihr USB-Ladekabel an.","Unser Ziel ist es die Produktion zu Starten und den Kunden den
Alltag zu erleichtern mit etwas Innovation.",Tarik Aytamga
0,Landwirtschaft,"Die Rasse ""Dexter"" gehört mit einer Größe von 1,0 bis 1,2 meter zu den kleinsten Rindern der Welt, dennoch heißt es doch so schön: Kleinvieh macht auch Mist , aus diesem Grund möchte ich mit eurer Hilfe in einen gebrauchten Traktor als Arbeitsgerät investieren, damit meine kleine Herde stets ein klein wenig wachsen kann und ich der anfallenden Arbeit gewachsen bin. 
Wenn ihr mehr über den ""Anaider Dexterhof"" wissen wollt und sehen wollt was es noch für Tiere bei uns gibt, folgt uns auf Instagram",Michael Schuller,Waldershof,10.000 €,25.000 €,"Traktor, Kühe, Zwergrinder, Landwirtschaft","In meinem Projekt geht es um die Anschaffung eines Schleppers,
der es mir erlaubt meinen Hof zu erweitern und die Zahl meiner
Kühe zu erhöhen. Da es zur Zeit noch eine Hobby Landwirtschaft
ist, die ich neben meinem Hauptberuf betreibe wäre das eine große
Hilfe in punkto Zeitersparnis, Arbeitserleichterung und eine
Perspektive meinen Hof auszubauen.","Mein Ziel ist es, meinen Hof weiter auszubauen und die Anzahl
meiner Dexter stetig zu erhöhen und deren Versorgung und Pflege
meistern zu können.",Michael Schuller
0,Technologie,"Unser neues Projekt ist ein völlig anders entwickelter Schraubendreher, bei dem man mit 1 Klick zwischen Kreuz- und Schlitzschraubendreher wechseln kann. Er soll zu einem unverzichtbaren Helfer in jedem Haushalt werden. Keine teuren Werkzeuganschaffungen mehr da 2 in 1. Keine umständlichen Wechsel mit verschiedenen Bits. Wir nennen ihn unseren „Volksschraubenzieher“. Einfach wieder mit Spaß und bequem Zuhause Heimwerken.",Haiko Paul,Berlin,6.500 €,,"Innovation, Hilfsprojekt","Unser neues Projekt ist ein völlig anders entwickelter
Schraubendreher, bei dem man mit 1 Klick zwischen Kreuz- und
Schlitzschraubendreher wechseln kann. Er soll zu einem
unverzichtbaren Helfer in jedem Haushalt werden. Keine teuren
Werkzeuganschaffungen mehr da 2 in 1. Keine umständlichen Wechsel
mit verschiedenen Bits. Wir nennen ihn unseren
„Volksschraubenzieher“. Einfach wieder mit Spaß und bequem
Zuhause Heimwerken. Die Zielsumme hier soll dazu dienen, eine so
relevante Menge in der Produktion herstellen zu lassen, dass für
den Endverbraucher ein fairer und erschwinglicher Preis entstehen
kann. Jenen, die im Rahmen dieses Projektes oder auch später im
Handel ihr eigenes Modell erhalten, wünschen wir jede Menge Freude
damit.","Die Zielgruppe ist JEDER der gern bastelt, heimwerkelt oder
einfach nur wieder unkompliziert ein IKEA - Regal aufbauen
will.",Haiko Paul
0,Film  Video,"Idee: 
Es soll ein Musikvideo für einen Singer/Songwriter produziert werden. (inkl. Making of) 
 Inhalt: 
Der Song handelt von einer Liebesaffäre zwischen einem jungen Musiker und einer jungen, attraktiven schwarzhaarigen Frau. Beide verstehen sich sehr gut, allerdings nur auf der körperlichen Ebene, alles Weitere stellt sich als schwierig dar. 
Es werden Szenen an unterschiedlichen Locations (Van, Loft, Wald, Bar, Stadt bei Nacht) gedreht. 
Wie geht die Geschichte aus...",Team Lament,Wiesbaden,1.000 €,,"Abschlussfilm, Wiesbaden, Musik, musikvideo, studentenprojekt","Das Projekt ist eine Abschlussarbeit zweier Studenten der
Hochschule RheinMain im Studiengang Media: Conception &
Production.","Das Projektziel, ist es ein Musikvideo sowie eine Social Media
Konzept und Coporate Design für einen Musiker zu erstellen.",Johannes Frisch Maximilian Krumbe
0,Musik,"Ihr unterstützt deutschFM 
Das Internetradio für „nur“ deutschsprachige Hits & Newcomer 
beim Bau eines echten Sendestudios... 
 #deutschFM",deutschFM,Winsen (Luhe),2.500 €,,"Webradio, Studio, Sendestudio, Radio, deutschFM","
plant mit Eurer finanziellen Hilfe und nach erfolgreicher
Realisierung des Projektes hier auf Startnext den Bau eines
Sendestudios",Ziel ist der Bau eines Sendestudios.,deutschFMonAir.de Ariane Schröder Frederik Stockfleth Ariane Schröder Raimund Lürßen
