0,Musik,"VLAD IN TEARS existieren nun seit 10 Jahren und das sollte gefeiert werden! Und mit wem könnten wir das besser feiern als mit EUCH - unseren Fans, ohne die das gar nicht möglich gewesen wäre! Wir möchten DANKE sagen und Euch mit auf eine Tour nehmen, die es so vorher noch nicht gegeben hat. 
Natürlich muss das Ganze aber auch erst einmal finanziert werden! Und hierfür brauchen Eure Hilfe! Im Gegenzug haben wir uns einiges für Euch einfallen lassen und hoffen auf Eure Unterstützung! STAY VLAD!",Vlad In Tears,Berlin,7.000 €,,"show, music, Fans, Tour, Band","Wir möchten in erster Linie mit unseren Fans das 10jährige
Bandbestehen von Vlad In Tears feiern. Um solch Tour zu
realisieren, braucht man aber natürlich die finanziellen Mittel,
die schnell mal den Rahmen sprengen. Damit wir Euch die
bestmögliche Show bieten und vor allem in möglichst vielen
Städten spielen können, muss eine entsprechende Produktion her -
und die kostet was. Ganz zu schweigen von Logistik und Crew.","Ziel ist es, 7.000 Euro zusammen zu bekommen und dadurch eine
Tour zu finanzieren, mit der wir möglichst viele unserer Fans
erreichen und auch mal wieder in Städten spielen können, die
vielleicht nicht immer auf unserer Reiseroute stehen.",Melanie Kueppers Dario Miconi
0,Food,"Du bist aktiv, um Deinem Körper etwas Gutes zu tun? Dann versorge Dich auch mit einem guten Getränk! Herkömmliche isotonische Sportgetränke enthalten Zusatzstoffe, auf die wir getrost verzichten können. Wir setzen auf natürliche Elektrolyte aus Baobab und Kokoswasser. BAOWOW Hydration ist der erste natürliche isotonische Durstlöscher mit direkt gehandelten Zutaten aus biologischem Anbau. Mit Deinem Funding trägst Du zum Einkommen von rund 3.500 Familien im ländlichen Simbabwe bei.",Berlin Organics,Berlin,16.000 €,,"Isotonisch, Social Business, Sportgetränk, biologisch, Getränk","
Weg mit Süßstoffen, Aromen und Geschmacksverstärkern, her mit
natürlichen Zutaten aus biologischem Anbau und direktem Handel.
Die Natur liefert uns dafür die perfekten Zutaten, u.a.:","BAOWOW Hydration spricht aktive, gesundheits- und
ernährungsbewusste Menschen an, die lieber auf Natur, statt auf
Chemie setzen. Dabei muss man kein Hochleistungssportler sein.",Carolin Luhnen Klaas Koolman
0,Musik,"Das Orchester MUSIKA AKKORDIA ist das Schülerorchester der Musikschule Fröhlich in Berlin/Nordost und Märkisch-Oderland. Ca. 50 Erwachsene, Jugendliche und Kinder musizieren hier gemeinsam. Nach der Produktion einer Klassik-CD im Jahr 2013 ist der Wunsch entstanden, eine CD mit bekannten aber auch weniger bekannten Filmmusik-Titeln aufzunehmen. Die Aufnahmen sind beendet. Für Mastering und die Produktion einer Doppel-CD im Buchformat brauchen wir nun finanzielle Unterstützung.",MUSIKA AKKORDIA,Berlin,1.500 €,,"Orchester, CD, Filmmusik, Akkordeon","Aufnahme, Mastering und Produktion einer eigenen Filmmusik-CD
des Orchesters. Die Ton-Aufnahmen haben wir bereits gemacht. Mit
dem Crowdfunding-Projekt soll professionelles Mastering, Design des
Booklets und die Pressung von 1000 Doppel-CDs finanziert werden. Es
wird eine CD mit Filmmusik aus Filmen für Erwachsene und eine
zweite CD mit Filmmusik für Kinder geben. Im Booklet, das als
Hardcover-Buch geplant ist, werden unsere Orchestermitglieder
verschiedene Filmszenen und Filmplakat-Motive nachstellen und ihr
könnt mit Texten und Bildern ein wenig hinter die Kulissen der
Orchesterarbeit schauen und Interessantes zu den einzelnen Titeln
erfahren.","Musikbegeisterte aller Genres und aller Altersgruppen und
natürlich Freunde der Filmmusik.",Constance Hartung kerstin kupke S.Gräming Björn Kasan Christian Rudolf
0,Mode,Mädchen wollen Raketen! Jungs wollen Pink! - In der Kleiderbande verwirklichen wir Kinderwünsche nach mehr Vielfalt im Kleiderschrank. Dazu wollen wir eine nachhaltige Produktion aufbauen. Und wir wollen unsere eigenen Stoffe drucken lassen - z.B. mit pinken Raketen drauf. Mit deiner Hilfe können wir die ersten 300 Kleidungsstücke herstellen.,Kleiderbande,Berlin,7.000 €,9.000 €,"fair, Nachhaltigkeit, kids fashion, Kindermode, unisex","In der Kleiderbande machen wir unisex Kleidung, die trotzdem
kindgerecht ist. Wir spielen mit Farben, starken Aufdrucken und
Mustern, und wir achten besonders darauf, dass die Kleidung
langlebig und spieltauglich ist. Indem wir eine eigene Produktion
aufbauen, können wir unisex Kleidung für viele Kinder möglich
machen.","Unser Ziel ist es, eine nachhaltige Produktion für unisex
Kinderkleidung aufzubauen. Dazu produzieren wir mit hochwertige
Materialien, denn so hält die Kleidung lange und kann auch noch
von Geschwistern und Freunden getragen werden.",Susanne Weller
0,Event,"Das Rock Center City Festival ist für alle Musikbegeisterte in Bremerhaven und von außerhalb DAS Festival im Herzen der Seestadt. 
Um euch ein spektakuläres und unvergessliches Festival bieten zu können, müssen selbstverständlich einige Dinge bezahlt werden. 
Sei es die Bühne, sanitäre Anlagen oder Security. Aus diesem Grunde suchen wir via Starnext eure Unterstützung, welche wir durch exklusive Supporter-Festival-Tickets und/oder Goodies rund um das Festival entlohnen werden!",Kevin Ricke,Bremerhaven,10.000 €,,"Festival, bremerhaven, rock center, Musik, Party","Bei dem Rock Center City Festival möchten wir euch, verteilt
über zwei Tage, mit Bands aus der Region, von außerhalb und sogar
aus dem Ausland zusammenbringen. Das Rock Center City Festival
hatte bereits in der Vergangenheit mit bekannten Bands wie Powder
for Pigeons aus Australien, Nervana aus den U.S.A. oder Radio
Havanna aus Berlin begeistert. Nach zwei Jahren Pause möchten wir
im Sommer 2017 wieder mit euch zusammen durchstarten und
feiern.","Trotz vieler ehrenamtlicher Helfer und Seitenakteure verursacht
ein organisiertes Festival hohe Kosten, lange bevor überhaupt
irgendein Musiker auf der Bühne stehen kann.",Kevin Ricke
0,Landwirtschaft,"Wenn der Huf eines Pferdes auf den Boden kommt jauchzt er vor Freude, denn er weiß heute wird er nicht von einem Traktor zusammengepresst und zermalmt, sondern bekommt vieleicht noch einen haufen Dünger. 1 oder 2 PS zu tanken ist ziemlich einfach. Man brauch nur ein stückchen Wiese. Dauert halt ein bisschen.",Theo Kaczmarczyk,Buckow (Märkische Schweiz),1.500 €,,"Freude, Pferde, öko, Bio, Gemüse","Ich möchte die Pferdearbeit erlenen um sie später auf einem
eigenen Betrieb im Bereich Gemüsebau anzuwenden.","Das Ziel meiner Gedanken kann ich nicht fassen. Ich kann sagen
in welche Richtung sie gehen.",Theo Kaczmarczyk
0,Musik,"We, the Berlin-based Progressive Metal Duo ""PeroPero"" will be releasing our second studio album this year. 
 The recording process as well as the mixing and mastering is already done - now we start the production of the album, which will be released in September 2017 on the viennese Label ""Panta R+E"" . In order to produce the CDs and LPs, finance the artwork, produce music videos and promote the album, we ask for your support.",Valentin Schuster,Berlin,5.000 €,,"Berlin, Rock, Metal, Album, Prog","About the production of the second studio album by
""PeroPero"".","Our goal is to expand the reach of our music further with this
production. Because of that, we enlisted promoters in Germany and
also Austria and we will tour extensively during October and
November this year.",Valentin Schuster
0,Musik,"Im Herbst 2016 starteten wir die Live-Tour unseres inzwischen 7. a cappella-kabarett Bühnenprogramms ""OHRakel - vokale Prophezeiungen"" und wollen dieses - so wie die anderen auch - auf CD bannen. Und zwar erstmals gemeinsam mit eurer Unterstützung.",VIERKANTER,Biberbach,8.000 €,,"ohrakel, Comedy, Kabarett, Musik, A Cappella","Endlich wieder eine LIVE-CD! Zu unserem 20-jährigen
Bühnenjubiläum haben wir uns entschlossen, möglichst
professionell und ohne bei der Finanzierung Abstriche machen zu
müssen, unser neues A-Cappella-Kabarett-Programm LIVE auf
Tonträger zu bringen. Dazu brauchen wir eure Unterstützung, denn
die CD soll etwas ganz Besonderes werden und ein großes Stück
Konzert-Feeling nach Hause bringen. Zusätzlich planen wir ein paar
Studio-Versionen als Bonustracks.","Diese Live-CD ist natürlich für alle gedacht, die sich ein
Stück VIERKANTER-Live-Feeling mit nach Hause nehmen wollen. Sei es
weil sie a cappella generell lieben, weil sie die genialen Texte
nachhören möchten oder einfach keine Vierkanter-CD in ihrer
Sammlung fehlen darf ...",Leopold Röcklinger Martin Pfeiffer Stefan Rußmayr Alois Röcklinger
0,Musik,"The last Hangmen aus Dresden meißeln endlich ihr drittes Album in Stein. Hymnischer, rasender, melodischer, epischer als je zuvor. Melodic Extreme Metal aus einem ganz hohen Regal. 
 Studio, Mix, Master, Pressung. Ihr helft uns dabei diese Posten zu stemmen. Im Gegenzug gibt's von uns gewohnt geile Mucke auf die Ohren! 
 Ganz ohne Studioschloss mit Sauna... Aber wenn ihr euch reinhängt, diesmal gleich mit passenden Video(s), Shirts und Bühnenprops dank variabler Stretchgoals!",Peter Hantsche,Dresden,3.500 €,,"Metal, Melodic, Death, bodom, wintersun","Dieses Mal hat es etwas länger gedauert, doch ihr wisst
vielleicht, was man über das dritte Album sagt: ""Make it or break
it.""","Das Hauptziel ist die Vollendung dieses Albums, das seine beiden
Vorgänger konsequent weiterführt, wenn nicht gar an allen Fronten
übertrifft. In der Fundingsumme von 3500 € enthalten sind also
Mix, Master, Studioaufnahmen, Artwork und die eigentliche
Pressung.",Peter Hantsche
0,Food,"Wusstest du, dass Deutschland Spitzenreiter in der Müllproduktion ist? Laut dem Statistischen Bundesamt produziert jeder von uns über 617 kg Müll im Jahr. Wir wollen diesen Müllwahnsinn mit dir gemeinsam stoppen und am 15.06.2017 Bottrops ersten verpackungsfreien Supermarkt eröffnen.",Allerlei Verpackungsfrei,Bottrop,18.000 €,35.000 €,"Plastik, Allerlei, verpackungsfrei, Umwelt, Zero Waste","Jeder von uns kennt es. Man legt bereits Wert auf hohe Qualität
bei seinen Lebensmitteln und Zuhause zeigt sich, dass man neben den
eigentlichen Lebensmitteln eine Menge Verpackungsmaterial gekauft
hat. Dieses landet dann direkt ungenutzt in unserem Müll. Die
giftigen und gesundheitsschädlichen Chemikalien haben sich jedoch
schon längst über die Verpackung auf unsere Lebensmittel
übertragen. Doch Einkaufen ohne Verpackungsmaterial ist im
Supermarkt kaum möglich. Viele Produkte sind bereits verpackt.
Selbst die Verpackungen bei Obst und Gemüse nehmen immer weiter
zu, obwohl diese bereits natürlich von ihrer Schale geschützt
werden.","Unsere Zielgruppe sind alle Menschen, die Wert auf Umweltschutz
und ihre Gesundheit legen. Denn Chemikalien aus
Kunststoffverpackungen werden auf unsere Lebensmittel übertragen
und erzeugen Krankheiten und Allergien. Des Weiteren sorgen die
18.000 Plastikteile je Quadratmeter im Ozean für ein zunehmendes
Tiersterben.",Sebastian Metzgen Annette Metzgen
0,Community,"Stella ist 9 Jahre alt, körperlich und geistig beeinträchtigt und sitzt im Rollstuhl. Der Zugang zu ihrem Kinderzimmer und dem Bad in dem die Pflege stattfindet ist nur über eine Treppe zu bewältigen, was es bei Stellas zunehmender Größe und Gewicht nahezu unmöglich macht mit ihr das Obergeschoß zu erreichen. 
Ein Kostenvoranschlag über 22.000 Euro liegt bereits vor, jedoch bezuschußt die Krankenkasse diesen mit nur 4000€. 
Lasst uns Stella helfen ein freieres Leben zu führen.",Edelbronxl Zündkatzen,Hauenstein,8.000 €,,"Mofa, Zündkatzen, Rollstuhlfahrer, Behindertengerecht, Stella","In dem Projekt gehts rund um Stella. Sie sitzt im Rollstuhl. Der
Zugang zu ihrem ihrem Kinderzimmer und dem Bad in dem die Pflege
stattfindet ist nur über eine Treppe zu bewältigen, was es bei
Stellas zunehmender Größe und Gewicht nahezu unmöglich macht mit
ihr das Obergeschoß zu erreichen.","Das Ziel ist die Finanzierung eines behinderten- und
rollstuhlgerechten Liftes für Stella.",Katrin Graf
0,Event,"Die Clown Convention ist ein besonderes Treffen zur Vernetzung und kreativen Weiterbildung von (Klinik-)Clowns und Theaterschaffenden aus ganz Deutschland. Sie ist ein selbstorganisiertes Zusammentreffen von einzigartigem Charakter. Die Teilnehmer treffen sich in Rostock um 4 Tage lang gemeinsam zu spielen, zu improvisieren und zu musizieren. In kleinen Workshops & Improvisationen bringen sie sich gegenseitig Techniken bei. Die entstandenen Szenen werden als Show der Öffentlichkeit präsentiert.",Rostocker Rotznasen- Klinikclowns im Einsatz e.V.,Rostock,3.333 €,,"Fortbildung, Zirkus, Clown, Kreativität, show",,"Ziel der Convention ist es, Begegnungen zu schaffen und
(Klinik-)Clowns deutschlandweit zu Vernetzen. Außerdem können
Ideen und Techniken aus den Workshops mit in die Kliniken getragen
werden und geben somit Input für die alltägliche Arbeit der
Klinikclowns in ganz Deutschland.",Steffi Ruddat
0,Sport,"footworks dance & fitness ist die neue urbane Tanzschule, die mit individueller Förderung und moderner Unterrichtsgestaltung einzigartig ist. 
Tanzbegeisterte und Fitnessfreaks finden hier das komplette Wohlfühlpaket für ihre Freizeit und können nicht nur Tanz- und Fitnesskurse besuchen, sondern auch auf einen Kaffee oder Cocktail vorbeischauen. 
Deine Lieblingskurse, dein Traum-Hochzeitstanz oder deine nächste Geburtstagsparty bei uns. Wir sind bereit.",Timo Breuer,Köln,35.000 €,60.000 €,"Tanzschule, Köln, Zumba, Fitness, Tanz","footworks dance & fitness wird sich konzeptionell vom
klassischen Tanzschulmarkt abheben und mit dem Klischee verstaubter
Tanzschulen aufräumen.","footworks dance & fitness ist die Adresse für angenehme
Freizeitgestaltung. Tanzunterricht für jede Altersklasse,
Fitnesskurse, Veranstaltungen wie Jazzkonzerte bis hin zum
individuellen Hochzeitstanz.",Timo Breuer
0,Social Business,"Du suchst regionale und ökologische Produkte mit sozialem Mehrwert? 
Du möchtest etwas zu sozialem Ausgleich beitragen? 
Qualität, Individualität und Regionalität sind Dir wichtig? 
Mit deinem good Shirt setzt du ein Zeichen für sozialen Ausgleich und Nachhaltigkeit und unterstützt den Aufbau des goodworks-Marktplatz. Dieser bietet ausschließlich Produkte mit sozialem Mehrwert und bildet eine Alternative zum derzeitigen Wirtschaftssystem, das auf Profit und Raubbau an Natur & Mensch aufgebaut ist.",Klemens Rybaczek,Eschenau,5.000 €,,"Ökolgoisch, Sozial, goodworks, T-Shirt, nachhaltig","Es geht um soziale Innovation, Beschäftigung, nachhaltiges
Wirtschaften und Ressourcenschonung.","Ziel dieses Projekts ist es, den goodworks-Marktplatz bekannt zu
machen und die Produktion von ca. 200 good Shirts zu
ermöglichen.",Klemens Rybaczek
0,Bildung,"Um in London vor Ort mobil zu sein und uns einige Sehenswürdigkeiten (Tower of London, Buckingham Palace, London eye ....und all die anderen sehenswerten Dinge in London.) anzuschauen, benötigen wir den London Pass mit Oyster Travelcard. Dieser Pass ermöglicht es uns die U-Bahn zu nutzen und uns die kulturellen Dinge der Stadt anzuschauen",ViktorFrankl,Aachen,1.440 €,,"Förder, Inklusion, Behinderung, London, Schule","wir sind die Klasse 9-10 der Viktor-Frankl-Schule in Aachen,
eine Schule für Kinder und Jugendliche mit körperlichem und
motorischem Entwicklungsbedarf.","Wir sind die Klasse 9-10 der Viktor-Frankl-Schule in Aachen,
eine Schule für Kinder und Jugendliche mit körperlichem und
motorischem Entwicklungsbedarf.",Paul Arns
0,Fotografie,"Als Abschluss der Instagram-Kunstaktion „Jeden Tag ans Meer“ ist eine 2-monatige Ausstellung mit 366 Fotoplatten geplant, mit anschließender Verschenkaktion. 
 Ohne finanzielle Unterstützung ist eine solche Ausstellung/Aktion im angestrebten Umfang nicht möglich, da keinerlei Gewinne erzielt werden sollen. 
 Als Anreiz für Unterstützer sind einige ""Dankeschöns"" vorgesehen, je nach Förderbetrag ...",Harald Bickel,Wyk auf Föhr,1.500 €,,"Fotoausstellung, Insel Föhr, instagram, iPhone, Nordsee","An den 366 Tagen des Jahres 2016 veröffentlichte Harald Bickel
jeden Tag ein tagesaktuelles Foto online unter dem Hashtag
#jedentagansmeer auf dem Fotodienst Instagram. Bis auf wenige
Ausnahmen sind alle Fotos an der Föhrer Küste entstanden. Als
Kamera kam ausschließlich ein iPhone zum Einsatz. Abonnenten
konnten die Aktion das ganze Jahr verfolgen und kommentieren.","Es geht um die Realisierung der Ausstellung im erweiterten
Rahmen. Die notwendigen finanziellen Mittel sollen sich auf viele
Personen verteilen, da mit der Ausstellung kein Gewinn erzielt
wird. Im Vorjahr wurde die Ausstellung noch komplett vom Künstler
finanziert.",Harald Bickel
0,Theater,"Wir - Lena Maria Steyer und Klemens Patek - haben uns in das Musical ""Die letzten 5 Jahre"" verliebt. Schon länger denken wir darüber nach, ein gemeinsames Projekt zu starten. Von der Idee des wunderschönen Musicals von Jason Robert Brown begeistert, arbeiten wir nun daran, das Stück mit sechsköpfiger Liveband im September in Wiener Neustadt auf die Bühne zu bringen. Dazu brauchen wir eure Unterstützung!",Die letzten 5 Jahre,Wiener Neustadt,2.500 €,,"Musical, Musiktheater, Theater","Wir wollen zwei Aufführungen des Musicals ""The Last Five Years""
im Theater im Neukloster in Wiener Neustadt finanzieren. Das
Theater kommt uns dankenswerterweise in vielen Dingen entgegen.
Doch für Techniker, Musiker, Aufführungsrechte, Kulissen,
Marketing und Co braucht es Geld. Vor allem wollen wir das Musical
mit voller Band-Besetzung aufführen - Klavier, Geige, Cello,
Gitarre, Bass, Schlagzeug. Oft wird bei kleineren Produktionen auf
Teile der Band verzichtet - wir wollen den vollen Klang nach Wiener
Neustadt bringen. Mit eurer Hilfe können wir es sicher schaffen,
unseren kleinen Traum zu finanzieren. Wir haben da ein paar gute
Angebote für euch :-)","Wir wollen für zwei Aufführungen mindestens je 150 Tickets
verkaufen (Kapazität: Je 200). Zielgruppe sind alle an
Musiktheater interessierten Menschen ab zehn Jahren im Raum Wien,
südliches Niederösterreich und Umgebung. Sollte das Projekt gut
ankommen, ist eine Wiederholung von Aufführungen an anderen Orten
der beschriebenen Gegenden nicht ausgeschlossen - sofern der Verlag
die Rechte freigibt.",Klemens Patek Lena Steyer
0,Musik,"Wir sind ""Far Behind The Sun"" aus Kempten und machen Instrumental Postrock. Im Dezember 2015 veröffentlichten wir unser Debut-Album ""Transmission"" das wir bis dato selbst finanziert haben. Nun geht es an das 2. Studioalbum, das am 17.11.2017 veröffentlicht werden soll.",Raphael Maag,Kempten (Allgäu),1.500 €,,"Musik, Album, Band, Tonstudio, Recording",Finanzierung des 2. Studioalbums von Far Behind The Sun.,"Unser Ziel ist es die neuen Songs hochwertig aufzunehmen. Als
Zielgruppe wollen wir alle Menschen, die Musik lieben und gerne
eine leidenschaftliche Band unterstützen wollen, erreichen.",Raphael Maag
0,Bildung,"In der Broschüre „Unter den Teppich gekehrt. Das Unterstützungsnetzwerk des NSU in Sachsen“ werden die maßgeblichen Unterstützer*innen des NSU in Sachsen identifiziert und ihre Unterstützungshandlungen offengelegt. Der geplanten Publikation gingen umfangreiche Recherchen voraus. Eure Mithilfe ist jetzt gefragt! Wir sehen es als eine zivilgesellschaftliche Aufgabe an, diejenigen öffentlich zu benennen, die es den Neonazis des NSU ermöglichten zehn Morde und drei Sprengstoffanschläge zu verüben.",KBSachsen,Dresden,3.950 €,,"NSU, Neonazis, Aufklärung, Terror, Zivilgesellschaft","Der Nationalsozialistische Untergrund (NSU) hat nach heutigem
Kenntnisstand mindestens zehn Menschen ermordet und mindestens drei
Sprengstoffanschläge verübt. Der Gerichtsprozess gegen die fünf
Hauptangeklagten vor dem Oberlandesgericht in München geht in das
vierte Jahr. Deutlich wird bisher vor allem, was die juristische
Aufarbeitung nicht leisten kann. Kaum sichtbar bleibt
beispielsweise das Unterstützungsnetzwerk, welches grundlegend zur
Ermöglichung der begangenen Straftaten beitrug. Unübersichtlich
bleiben auch die Ergebnisse der zahlreichen
Untersuchungsausschüsse im Bundestag und in den Landtagen, die zur
Aufklärung der Taten des NSU beitragen.","Die lückenlose Aufarbeitung der Taten und Unterstützer*innen
des NSU ist nichts, was allein juristisch, parlamentarisch oder
journalistisch geleistet werden kann. Es braucht darüber hinaus
auch eine wissenschaftliche und eine zivilgesellschaftliche
Aufarbeitung.",SuseKBS Michael Nattke
0,Hörspiel  Hörbuch,"Wir wollen unsere 2. Hörspiel-CD produzieren: „Willy Wolf & das Wiesenglück“ - musikalisches Hör-Theater für Klein und Groß. Selbst geschrieben, komponiert und inszeniert. Viola schlüpft stimmvirtuos und spielfreudig in die verschiedenen Rollen und spielt die Instrumente. Es entsteht ein besonderes Hör-Theater, das sich an den wunderbaren Hörspiel-Aufnahmen der Ostberliner Studios orientiert - mit Geräuschemachern, Livemusikern und guten Schauspielern. Wer uns kennt, weiß: Es lohnt sich. Danke!",Clownstheater-Macher,Berlin,1.500 €,2.700 €,"Theater, CD, Musik, Kinder, Hörspiel","
Klar, "," ist die Veröffentlichung unserer 2.
Hörspiel-CD „Willy Wolf und das Wiesenglück“ - einem
musikalischen Hörtheaterstück über einen Neubeginn und über
Musik, die Pforten öffnet und Welten verbindet.",Julia Wegehaupt Anja Zimmermann
0,Musik,"Hallo ihr lieben, es ist endlich so weit und ich kann es kaum erwarten meine neuen Songs bald mit euch teilen zu können – ich bekomm das Grinsen nicht aus dem Gesicht :) 
Es ist schon viel getan worden: Die Songs sind geschrieben und befinden sich momentan in der Produktion bei Udo Rinklin. Die erste Single ""Let It Show"" konnte ich bereits sogar mit Musikvideo veröffentlichen. 
Es gibt dennoch einiges, was noch getan werden muss und dafür brauche ich EUCH! Denn ohne euch geht sowieso nichts.",Lea Braun,Karlsruhe,5.000 €,8.000 €,"Debüt, Album, Lea LaDoux, indie pop","Mein Debut Album ist eine Sammlung der persönlichsten,
wichtigsten und aussagekräftigsten Songs, die ich bisher
geschrieben habe. Die Message ""Du darfst so sein, wie du bist""
steht klar im Mittelpunkt meiner momentanen Arbeit, weil ich eine
lange Reise von Selbstzweifeln über Aufgeben bis hin zu
Selbsterkenntnis und Neustart hinter mir habe und nicht anders
kann, als das ganz unbedingt mit euch teilen zu wollen.","Das Ziel ist die Fertigstellung meines Albums und alles, was
drum rum geschehen muss, damit es möglichst viele Menschen
erreicht.",Lea Braun
0,Community,"Das Village ist ein neues internationales, urbanes Gemeinschaftszentrum im Herzen Berlins. Das Village ermöglicht neue Formen der Gemeinschaft, Verbindung und sozialer Innovation, die auf Achtsamkeit, Inklusivität und intergenerationalem Austausch basieren. Um uns dauerhaft zu finanzieren, ist es unbedingt nötig unser zweites Studio, dessen Holzboden während eines Starkregens im Juli 2016 zerstört wurde wieder aufzubauen. Wir sind dankbar für Eure Unterstützung.",Kai Ehrhardt,Berlin,20.000 €,,"Community, Queer, Gay Bi Trans Cis, Male-Bodied, Male-Idendified",Was ist das Village?,ZIEL: das zweite Studio zur Einsatzfähigkeit bringen.,Kai Ehrhardt
0,Musik,"SKA und POLKA aus Dresden? Und das jetzt auch noch in Studioqualität? Geht das? Nu gloar: Wir wollen mit eurer Hilfe unser erstes Album an den Start bringen. Anfang des Jahres waren wir im Tonstudio und haben mit großartigen Gastmusikern ein wirklich einzigartiges Studioalbum aufgenommen. Dieses hebt sich schon allein durch das Zusammenspiel mit unseren Gästen deutlich vom Liveprogramm ab und soll als eigenständiges, bleibendes Kunstwerk bei euch in der Plattensammlung stehen.",Offbeat Cooperative,Dresden,6.000 €,,"Offbeat Cooperative, Ska, Polka, debut album, Dresden"," Anfang des Jahres waren wir schon im
Tonstudio und haben mit großartigen Gastmusikern ein wirklich
einzigartiges Studioalbum aufgenommen. Dieses hebt sich schon
allein durch das Zusammenspiel mit unseren Gästen deutlich vom
Liveprogramm ab und soll als eigenständiges, bleibendes Kunstwerk
bei euch in der Plattensammlung stehen. Gleichzeitig wollen wir uns
daran wagen, dass ihr die Musik auch ständig auf Spotify zur
Verfügung habt und das ein oder andere Lied auch mal im Radio
hören könnt.","
Sichert euch schon jetzt eines der Dankeschöns und seid euch
unserer unendlichen Dankbarkeit bewusst. Die Zielgruppe dieses
Projektes seid ihr! Ihr und eure Freunde, Verwandten, Nachbarn und
alle anderen Menschen, die vielfältige, tanzbare und lebensfrohe
Musik lieben. ",Johannes Angermann Sophie Pianski Matthias Richter Tobias Angermann Jojo Filous
0,Umwelt,"Wir lieben Kaffee. Und wir wollen ihn immer und überall genießen. Der Preis für die Umwelt ist hoch. So hoch wie die Einwegbecher-Müllberge aus Papier, Pappe und vor allem - Plastik. 
 Plastik ist das größte Problem. Es lässt sich nur sehr aufwendig wieder verwerten, verrottet nicht und verschmutzt und vergiftet schließlich die Meere. 
 Darum entwickeln wir mit der ecosign Akademie in Köln einen 100% plastikfreien Mehrweg-Kaffeebecher. 
 No waste. No plastic. Just coffee.",Joachim Grimm,Hamburg,6.000 €,,"Umweltschutz, Kaffee, Mehrwegkaffeebecher, plastikfrei, zerowaste","Ihr habt unseren Film gesehen? Hier noch mal die Zahlen der
Deutschen Umwelthilfe aus dem Jahr 2015.",1. Die Reduzierung und Vermeidung von Müll.,Joachim Grimm
