0,Community,"Das objekt klein a ist unser Anteil zur Rettung einer ehrlichen, der Musik und der Gemeinschaft verpflichteten Subkultur. Im Dresdner Norden gingen wir vor Anker und zimmern seitdem ohne Unterlass am neuen Flaggschiff der Dresdner Partyflotte. Auf 300 qm erstrecken sich zwei durch einen Lichthof verbundene Floors. Der weitläufige, von Bäumen flankierte Außenbereich entsteht in Zusammenarbeit mit unseren Freund*innen vom Palais Palett e.V.",objekt klein a,Dresden,25.000 €,40.000 €,"Dresden, Kultur, Kunst, Techno, Club","Von Musik beseelt, den Wind of Change im Rücken, machten wir
uns auf die Suche nach einem Ort für unsere Hirngespinste. Die
Zeit war reif, unsere Vision selbstbestimmten Zusammenseins zu
verwirklichen. Was uns antreibt, ist der beständige Wunsch, den
flüchtigen Momenten spontaner Seligkeit eine Heimat zu geben. Den
Soundtrack dafür liefern Szenegrößen ebenso wie Nachwuchstalente
der elektronischen Musik. Außerdem soll das objekt klein a all
denen Raum bieten, die sich gemeinsam mit uns an einem kulturellen
Pipapo versuchen wollen. Wir haben Platz für Konzerte, Theater-
& Filmvorstellungen, Performance, Ausstellungen, Lesungen und
Diskurs.","Wie derzeit glücklicherweise viele Kulturakteur*innen in
Dresden wollen auch wir unseren Beitrag für eine aufgeschlossene
und kunterbunte Stadtgesellschaft leisten. Jenseits barocker
Kulissen feiert eine solche allwöchentlich das Leben, die Musik
und den außeralltäglichen Wahnsinn. Ihnen widmen wir das objekt
klein a, einen Ort zum lauschen und plauschen, musizieren,
diskutieren, zum tanzen und verfransen.",Jakob Bahr svenadam.office Albrecht Boenke Joshua Peschke Anuschka Fischer Felix Mueller Clemens Schmiegel Marvin Grn Toni Schlüßler Felix Buchta Thomas Meerpohl
0,Social Business,"Die Hälfte aller Lebensmittel in Europa werden verschwendet, wobei ein Großteil noch genießbar ist. SirPlus revolutioniert zusammen mit der Lebensmittelindustrie das Retten von Nahrungsmitteln. Wir verkaufen überschüssige Lebensmittel in Berlins erstem Food Outlet Laden, per Same-Day-Delivery und per Online Shop mit Lieferung innerhalb Deutschlands. Lasst uns das Lebensmittelretten mainstream machen und damit die Wertschätzung von Lebensmitteln steigern! Helft uns - jeder Beitrag zählt!",SirPlus,Berlin,50.000 €,150.000 €,"Umwelt, Nachhaltigkeit, Lebensmittel retten, Social Entrepreneurship, food waste","Mit SirPlus retten wir zusammen mit Akteuren der
Lebensmittelindustrie große Mengen überschüssiger, der Norm
nicht entsprechender und abgelaufener Lebensmittel bei Landwirten,
Produzenten, Logistikern, Groß- und Einzelhändlern und bringen
sie verantwortungsvoll in den Kreislauf zurück. Die Lebensmittel
werden dabei von SirPlus bis zu 70 Prozent günstiger verkauft.
Privatkunden und Firmen können die gerettete und perfekt
genießbare Ware direkt im SirPlus Laden in Berlin kaufen - dem
ersten Food Outlet der Hauptstadt, welcher ausschließlich
gerettete Lebensmittel anbietet- oder die Ware über den
Online-Shop mit Lieferung innerhalb Deutschlands beziehen. In
Berlin sogar mit Versand innerhalb eines Tages: so sparst Du nicht
nur Geld, sondern vor allem auch Zeit - und gewinnst damit mehr
Lebensqualität!","Ziel von SirPlus ist, die Verschwendung von Lebensmitteln massiv
einzudämmen, Lebensmittelrettung zu professionalisieren bzw.
mainstream zu machen und damit die Lebensmittelindustrie zu
revolutionieren. Zusammen mit unseren Partnern werden wir mit
SirPlus zunächst in Berlin, dann auf bundesweiter Ebene - später
auch international - das Thema Lebensmittelverschwendung nachhaltig
angehen. Damit verbundenes Ziel ist, so signifikant Ressourcen zu
schonen, der Überproduktion entgegenzuwirken und den CO2-Ausstoß
erheblich zu reduzieren. Durch SirPlus gewinnen alle beteiligten
Zielgruppen: der Lebensmittelshandel, der durch SirPlus enorme
Entsorgungskosten einspart, die Umwelt, da Treibhausgasemissionen
reduziert werden und vor allem die Verbraucher, die mit Hilfe von
SirPlus den eigenen Geldbeutel und nicht zuletzt das Gewissen
entlasten. Mit SirPlus ermöglichen wir allen Menschen, sich für
die Wertschätzung von Lebensmitteln einzusetzen und dabei sogar
Geld und Zeit zu sparen. Jeder Konsument kann nun mit seiner
Entscheidung, SirPlus zu unterstützen, einen Beitrag leisten, die
Welt ein Stück besser zu machen. Langfristiges Ziel von SirPlus
ist, mit seinen Initiativen ein Umdenken von Lebensmittelakteuren
und Konsumenten zu ermöglichen und zu fördern. Damit soll
zukünftig Lebensmittelverschwendung gar nicht erst entstehen und
folglich die Produktion von Lebensmitteln auf ein gesundes und
nachhaltiges Maß erfolgreich reduziert werden.",Raphael Fellmer Alexander Piutti Martin Schott
0,Sport,"Max Morlock war Ikone und zugleich größter Fan des 1. FCN. Er hat das Wunder von Bern ermöglicht, war zweimal Deutscher Meister und Fußballer des Jahres. Dennoch blieb er seinem Verein immer treu. Statt dem Ruf des großen Geldes zu folgen, stand er lieber in seinem Kiosk in der Nürnberger Südstadt. Wir wollen ihm ein Denkmal setzen und das Nürnberger Stadion in Max-Morlock-Stadion umbenennen. Dafür brauchen wir Eure Hilfe. Lasst uns gemeinsam Geschichte schreiben!",Max gemeinsam,Nürnberg,800.000 €,,"franken, 1. FCN, Max gemeinsam, Fußball, Nürnberg","Seit vielen Jahren träumen die Fans des 1. FCN von einem
Stadion, das Max Morlocks Namen trägt. Viele haben bereits
versucht, diesen Traum zu verwirklichen, doch geklappt hat es
bisher leider nicht. ","Unser Ziel ist es, dem Nürnberger Stadion den Namen zu geben,
den es verdient: Max-Morlock-Stadion. Diesen Traum teilen wir mit
Tausenden Club-Fans, die nun endlich die Möglichkeit haben, an der
Verwirklichung dieses Traums mitzuwirken. Allerdings sind es nicht
nur Fußball-Begeisterte, die Max Morlocks Namen auf dem Stadion
sehen möchten. Schließlich war er ein Held aus Franken, der die
Augen der Welt auf uns gerichtet und auch sonst viel für unsere
Region getan hat. Wenn Ihr auch der Meinung seid, dass er dafür
nicht anständig gewürdigt wurde, dann unterstützt unsere
Initiative!",Rainer Hohenberger Claudia Boehmer Ismail Turgut Moritz Richter Thilo Färber Ingo Di Bella Lampe Curt Marion Voigt Nina Pietropoli Marco Schnös Lorand Toma Christian G Silberhorn Stefan Weiner Oliver Förschner Christian Wolff Ramona Piehl Ahmet Iscitürk
0,Event,"In der Woche der Herausforderung geht es darum, dass die Klasse gemeinsam eine Herausforderung zu meistern versucht und dabei die Klassengemeinschaft gestärkt wird. In der diesjährigen Herausforderung haben wir geplant, in den Voralpen an den Lechweg zu fahren und die Klasse mit einer Wanderung zu fordern. Wir sollen die Herausforderung selbst finanzieren. Das hat den Effekt, dass wir lernen, dass Geld nicht vom Himmel regnet, und wir lernen mit Geld verantwortlich umzugehen.",Klasse 11 der Montessori Gesamtschule,Friedrichsthal,500 €,,"Lechweg, Montessori, Herausforderung, Alpenwanderung, Klasse 11","Es geht um eine selbstorganisierte und selbstfinanzierte
Klassenfahrt, in der die SchülerInnen sowohl körperlich als auch
mental beansprucht werden. Die Herausforderung hat das Ziel, den
Klassenzusammenhalt zu stärken. In den vergangenen Jahren gingen
die SchülerInnen der Klassen 11 vor uns z. B. im Juragebirge
wandern oder auf dem Eiselmeer segeln. Wir haben uns dieses Jahr
vorgenommen, in den Voralpen wandern zu gehen. Der Ausgangspunkt
unserer Wanderung ist Pflach. Von dort geht es entlang des Lech
über die längste Brücke der Alpen im Holzgau und aufwärts zur
Kemptner Hütte bis hinunter nach Oberstdorf. Wir werden mit An-
und Abreise 6-7 Tage unterwegs sein, nach Pflach und von Oberstdorf
zurück geht es mit dem Zug. Um dieses Ziel zu erreichen, brauchen
wir Ihre Unterstützung.","Das Ziel ist, dass alle SchülerInnen an ihre Leistungsgrenze
stoßen und trotzdem die Herausforderung überwinden. Im Vorfeld
ist es das Ziel, die Herausforderung selbst zu organisieren und zu
finanzieren.?Wir richten uns mit diesem Crowdfunding daher an
alle, die junge Menschen dabei unterstützen möchten, etwas
komplett selbst auf die Beine zu stellen.",Tobias Huwig Lennart wegener Marie Siggelkow
0,Community,"Bei EDITION F haben wir über zahlreiche tolle Persönlichkeiten und Experten geschrieben, Webinare mit ihnen gemacht oder Panels organisiert. Diese Menschen und ihr Wissen bündeln wir jetzt und kuratieren für dich die FEMALE FUTURE FORCE Academy. 52 Wochen digitales Coaching. 52 Top-Experten. 52 Videos, Interviews, Podcasts, Work Sheets und Fragebögen. 52 Wochen, die dich persönlich und beruflich wachsen lassen. Und 10 Prozent des Erlöses machen die Academy auch für benachteiligte Frauen möglich.",EDITION F,Berlin,100.000 €,1.000.000 €,"Coaching, Weiterbildung, Empowerment, Feminismus, Journalismus","Die Rufe nach „Frauen an die Macht“ sind laut – in der
Politik, in Unternehmen, überall. Aber was hat Frauen bisher
abgehalten? Jahrzehntelang wurden Frauen weniger gefördert. Und
das beste Wissen ist meist nur Top-Managern vorbehalten. Und das
für wahnsinnig viel Geld. Wir finden: Wissen sollte keine Hürden
kennen. Inspirieren. Und bezahlbar sein.","Es geht um Empowerment. Female Empowerment. Deshalb sprechen wir
zwar ganz gezielt Frauen an. Aber: Eine gleichberechtigte
Gesellschaft funktioniert nur gemeinsam mit allen – deshalb ist
die FEMALE FUTURE FORCE Academy für alle, die sich persönlich und
beruflich weiterentwickeln möchten. Wir haben das Programm für
all diejenigen kuratiert, die neuen Input oder Inspiration suchen,
noch unentschlossen sind, wo die Reise für sie hingehen soll oder
zwar das Ziel kennen, nicht aber den Weg. An diesen Punkten stehen
wir im Leben ja immer wieder mal – nach der Ausbildung oder der
Uni, wenn der aktuelle Job nicht mehr passt und die Sehnsucht nach
Veränderung wächst, nach der Elternzeit oder wenn eine Kündigung
nicht nur ein Schrecken, sondern auch eine neue Chance
bedeutet.",Susann Hoffmann Nora-Vanessa Wohlert
0,Event,"Am 2.7.2017 werden wir Mozarts Oper ""Don Giovanni"" in der Arena am Panometer Leipzig aufführen. In einer halbszenischen Inszenierung möchten wir dabei die Besonderheit des Raumes zusammen mit der Musik zu einem einzigartigen Erlebnis machen. 
 On July 2nd 2017, The Sommerorchester Leipzig will be playing Mozart's opera ""Don Giovanni"" at Arena am Panometer Leipzig, a beautiful outdoor performance space . Our semi-scenic performance of this iconic opera will be a once in a lifetime experience!",Julia Nagel,Leipzig,4.000 €,,"sommer, Musik, Oper, Event, Konzert","Unser SommerOrchester Leipzig besteht hauptsächlich aus
freiberuflichen Profi-Musikern, die mit Enthusiasmus und viel
Leidenschaft für Euch musizieren - deswegen möchten wir jeden
Musiker auch angemessen dafür bezahlen. Insgesamt sind wir mit
allen Beteiligten ca. 64 Orchestermusiker und Sänger - das heißt
also, dass wir dazu eine Menge Geld brauchen. Bitte helft uns
dabei!","Wir möchten Euch eine tolle Opernaufführung liefern! Deswegen
haben wir die Kartenpreise auch bewusst nicht zu hoch angesetzt,
damit sich das wirklich jeder von Euch leisten kann. Eine besondere
Zielgruppe gibt es nicht - bei uns sind alle willkommen! Wir haben
uns auch extra eine Inszenierung überlegt, bei der auch alle, die
niemals in einer Oper waren problemlos der Handlung folgen
können... also packt Eure Picknickdecke und kommt vorbei, wir
freuen uns auf Euch!",Julia Nagel
0,Musik,"Ich bin Mirko Santocono, Singer-Songwriter aus Rheinland-Pfalz, glücklich verheiratet und werdender Vater. 
Nach anfänglichen Versuchen meinen Weg zu finden, habe ich diesen nun betreten: Ich schreibe und präsentiere Lieder, für die ich mir wünsche, dass sie in den Köpfen hängen bleiben. 
Dies hat mich dazu bewegt mit der Produktion mein erstes Album zu beginnen. Werdet ein Teil von dem Album ""MEINE ZUKUNFT IST ANDERS""",MIRKO SANTOCONO,Norken,5.000 €,,"crowdfunding, Album, Pop, Santocono, Mirko","Ende 2015 war es nur eine Idee, 2016 die aktuelle Single
'Farben' auf die die Medien aufmerksam wurden, und geboren war das
Projekt Album.","Das Ziel ist die professionelle Produktion meines ersten Albums
mit 10 tollen Songs, auf das bereits Freunde & Wegbegleiter
gespannt warten.",Meine Zukunft ist anders Mirko Santocono
0,Mode,"CURIOUS & CUTE ist ein junges Label für durchdachte, farbenfrohe Baby- und Kindermode, in der Kinder sich richtig wohlfühlen und gut bewegen können. Alle unsere Kleidungsstücke werden in Deutschland aus hochwertigen, nach ÖkoTex Standard 100 zertifizierten Stoffen gefertigt. Für kleine Entdecker von 0 bis circa 5 Jahren.",CURIOUS and CUTE,Hamburg,3.000 €,5.000 €,"ÖkoTex Standard 100 Stoffe, Made in Germany, Kindermode, durchdachte, Farbenfrohe","Wir bei CURIOUS & CUTE finden, dass sich Kleidung den
","
Sie sollen sich ganz natürlich entwickeln und eine fröhliche
Kindheit haben. Auch in ihrer Kleidung sollen sie sich richtig
wohlfühlen. Mit viel Freude sollen sie sich drehen, robben,
spielen, toben, ihre Welt erkunden und immer selbstständiger
werden. Sie sollen sich an den farbenfrohen Motiven erfreuen und
sie gerne anziehen. Daher haben wir in die Schnittentwicklung das
Wissen von Hebammen, Physiotherapeuten und erfahrenen Eltern
einfließen lassen.",Johanna Rösch Anna Milewsky Anissa Kadiri Jan Rösch
0,Musik,"Vier Jahre nach Erscheinen unseres Debutalbums „Nine Shoots“ sind wir endlich bereit für die zweite Studiorunde und nehmen im Mai dieses Jahres unser neues Album auf. 
Wir halten zwölf eigene, ehrliche Songs in den Händen, in die wir viel Kreativität, Emotionen und Herzblut gesteckt haben. Für die Umsetzung unserer Kopfgeburten brauchen wir jetzt nur noch eins zu unserem Glück: eure Unterstützung. Helft uns bei der Finanzierung unseres Abenteuers und werdet somit Teil des Projekts.",Lizzy McPretty im Swingerclub,Leipzig,5.000 €,,"Leipzig, LizzyMcPretty, Country, Old-Time-Music, Folk","Seit fünf Jahren machen wir nun schon gemeinsam Musik. In
dieser Zeit ist unfassbar viel passiert: Wir haben wundervollste
Konzerte gespielt, durften tolle Menschen kennenlernen und haben
uns selbst musikalisch immer wieder neu entdeckt. Wir sind viel
gereist: haben auf staubigen Straßen und in bunten Zirkuszelten
gespielt, sind durch verlassene Wälder gestreift und haben
unglaubliche Geschichten gehört und erlebt - unter all diesen
Eindrücken haben wir zuletzt viele, viele neue Songs geschrieben.
Unser zweites Album soll die Quintessenz dessen werden, was wir in
den letzten Jahren gemeinsam musikalisch und emotional erlebt
haben.","Unser Ziel ist es, innerhalb des vorgegebenen Zeitraums,
mindestens 5.000,- € zu sammeln. Damit können wir einen Teil der
Kosten decken, die für Studio, Mix, Mastering, Artwork, Layout und
Pressung der Schallplatte, sowie der CD, anfallen. Wenn ihr
ehrliche, handgemachte und anspruchsvolle Old-Time-Music, abseits
des Mainstreams mögt, ist unsere Kampagne genau das Richtige für
euch!",Ulrike Lichtenberg Mr.Angry T Mr. Chicken-Picking-Fast-Finger Mark Hempel
0,Musik,"Seit meinem 15. Lebensjahr schreibe ich meine eigenen Songs. Nach 5 erfolgreich inszenierten, eigenen Musicals und einigen Auftragskompositionen wird es Zeit, meinen eigenen Traum vom ersten eigenen Album zu realisieren. 14 Songs die authentisch, realistisch und ganz persönlich aus meiner Seele kommen und von meinem Leben erzählen. Ich hoffe hier die Unterstützung zu finden um meinen Traum lebendig werden lassen zu können.",Thomas Decker,Murnau am Staffelsee,4.500 €,,"Studio, CD, Komponist, Songwriter, Album","In dem Projekt geht es darum mein erstes eigenes Album von der
Aufnahme im Tonstudio über Cover und Bookletgestaltung,
CD-Pressung bis hin zu Marketingmaßnahmen für den Vertrieb zu
finanzieren und zu unterstützen.","Ein großes Ziel wäre es, dass ich so ein Label finden kann,
dass mich zukünftig produziert und ein weiteres Ziel ist es
natürlich meine Musik so einem breiten Publikum zugänglich zu
machen. Da ich viele Genres bediene und nicht nur in einem Stil
komponiere, reicht meine Zielgruppe von Jugendlichen bis hin zu Oma
und Opa.",Thomas Decker
0,Sport,"Geno Biancheri, besser bekannt als der Pirat des Powerlifting, verleiht jedem Wettkampf eine einmalige Atmosphäre. Mit unverwechselbaren Kommentaren hat er einen bedeutenden Anteil an zahlreichen Rekorden und macht aus einem gewöhnlichen Sportevent eine Rockshow, die ihresgleichen sucht. Bisher nur dem Nationalteam vorbehalten, wollen wir ihn nun zur SM K3K Classic 2017 nach Österreich holen und allen ÖVK-Athlet/innen die Chance geben, einmal von der Legende persönlich angekündigt zu werden!",ÖVK - Österreichischer Verband für Kraftdreikampf,Wien,1.500 €,,"kraftdreikampf, ÖVK, Geno, Pirat, powerlifting","Gemeinsam den Piraten nach Österreich zu holen und einmal
dieses unvergleichbare Erlebnis auf heimischen Boden zu haben, das
bisher nur den Amis und der Weltelite vorbehalten war.","Alle ÖVK-Athlet/innen, Sportfreund/innen, Powerlifting-Fans und
Piraten! ;-)","Dr. Michael Schrems, MBA"
0,Film  Video,"In der „Quiet Zone“ gibt es kein Wlan, kein Radio- oder Handyempfang, nicht mal technische Geräte dürfen in nächster Nähe des riesigen Radioteleskops genutzt werden. Die Zone ist auch Zufluchtsort für Menschen, die von elektronischen Signalen in Städten krank geworden sind. Für einige ist die Quiet Zone der einzige Ort, an dem sie noch leben können. Alle halten sich an die Regeln und nutzen keine Technik, alle bis auf Einen.",Die Quiet Zone,Ludwigsburg,5.000 €,,"Quiet Zone, Tim Ellrich, Radioteleskop, kurzfilm, Elektrosensibel","Georg, ein Elektrosensibler Bewohner, nutzt heimlich am
Zonenrand sein iPad und surft im Internet. Plötzlich tauchen in
der Zone unbekannte Störsignale auf, die nicht nur bewusstlose
Elektrosensible hinterlassen, sondern auch die Forschung des
Teleskops lahm legen. Es scheint, als wäre eine unsichtbare Macht
am Werk. Als Georg herausfindet, dass er doch irgendwie mit den
Störsignalen in Verbindung steht, versucht er dies zu
verheimlichen, um nicht aus der Zone geschmissen zu werden. Harald,
einer der Forscher im Teleskops, der in die Zone strafversetzt
wurde und endlich seine Messung abschließen will, kommt Georgs
Geheimnis immer näher. Auf der Suche nach der Identität des
Angreifers, muss sich Georg seinem wahren Problem stellen.","Zielgruppe sind alle, die gerne außergewöhnliche Filme sehen,
die universelle Themen unserer Zeit behandeln.",Tim Ellrich Ben Zerhau Leopold Pape Dominik Huber
0,Musik,"Schillernde Gitarren-Sounds, verträumte Texte und treibende Rhythmen erwarten Euch auf unserem ersten Album ""somme partel - somme partel"". Die Musik ist schon lange fertig - nur das nötige Geld für die Veröffentlichung fehlt noch. Helft uns dabei, diesen Traum zu erfüllen - Und sichert Euch nebenbei die ersten Exemplare sowie tolle Dankeschöns!",somme partel,Münster,1.000 €,,,"Unser Debut-Album ""somme partel - somme partel"" entstand bereits
zwischen Dezember 2015 und März 2016 in den australischen Blue
Mountains.","Dieses Album, das nun schon so lange auf seine heißersehnte
Veröffentlichung wartet, möchten wir nun endlich auch Euch hören
lassen!",somme partel
0,Food,"Die erste ökologische Kühlbox aus 100% recyclingfähigen Materialien für den Outdooreinsatz! 
Unser Versprechen: 4 Tage lang gekühlte Lebensmittel ohne Strom oder andere Hilfsmittel! Wie? Die einzigartige Kombination unserer Festivalbox mit den bewährten easyAkkus sorgt für 100 Stunden Kühldauer. 
 Das Beste: für alle, die keine Lust und Zeit zum Einkaufen haben, kommt die Festivalbox bereits gefüllt mit bestem Grillfleisch und Dosenbier gut gekühlt bei euch zu Hause an.",easy2cool,München,10.000 €,25.000 €,"Festival, kalte Lebensmittel, easy2cool","Wir wollen die erste ökologische Kühlbox für Festivals und
Freizeit an den Start bringen.","Badewannen, Sockenkühlung, Erdloch und andere sogenannte Tricks
sollen der Vergangenheit angehören!",Marco Knobloch Sebastian Leicht
0,Community,"Connect, Support, Make a Change – Unter diesem Motto haben wir die KonfettiApp entwickelt, um Nachbarn spielerisch zusammen zu bringen. Als digitales Werkzeug dient Konfetti dabei der Unterstützung von Organisationen und Initiativen in der Flüchtlingsarbeit. Über gemeinsame Aktivitäten, die über die App koordiniert werden, möchten wir das gegenseitige Kennenlernen befördern und zum Abbauen von Vorurteilen beitragen. Zusammen Nachbarschaft gestalten: Im ersten Schritt braucht es nur eine Idee!",Die Konfettibande,Berlin,10.000 €,,"Nachbarschaft, Karma, Integration, OpenSource, App","Konfetti bringt alteingesessene und neue Nachbarn spielerisch
zusammen und ist eine Einladung sich gemeinsam für eine
harmonischere Nachbarschaft zu engagieren.","
",Maxie Lutze Patrick Pachur othman.m jennys. Romy Lutze Stephanie Ehrlich Christian Rotzoll
0,Musik,"Wir Piraten von ELMSFEUER haben endlich den langersehnten Nachfolger des Debutalbums ""Schatzsuche"" aufgenommen. ""Teufel der Meere"" ist kurz davor, das Licht der Welt zu erblicken. Ganze 11 fesselnde Stücke mit einer Gesamtspielzeit von 48 Minuten haben den Weg auf das Album gefunden. Produziert wurde das Ganze im Obscure Music Studio in Frankfurt. Für den letzten Schritt zum Release benötigen wir jedoch Eure Unterstützung.",Andre Abram,Offenbach am Main,2.000 €,,"CD-Release, Piratenrock, Elmsfeuer, Mittelalterrock",,,Andre Abram
0,Theater,"Wir sind das erste Theater im Internet und senden ab Ende Mai Stücke via Livestream und über das Social Media. Ein Theatererlebnis im digitalen Raum, das für jeden Zuschauenden kostenlos und werbefrei zugänglich ist. Auf unseren letzten Metern brauchen wir jetzt noch einmal einen finanziellen Schub, damit unsere technische Ausstattung in der Lage ist, alles qualitativ hochwertig über den Bildschirm zu bringen. Das bedeutet: Kameras, Mikrofone, Soundkarten, Beleuchtung - das läppert sich nochmal.",onlinetheater.live,Berlin,2.000 €,,"Live, Film, Web, Internet, Theater","Es geht darum, im Internet mal einen Gegenentwurf zu bringen zur
kommerziellen Unterhaltungsbranche. Theater könnte das ziemlich
gut, blöderweise ging bisher kein Theater den Schritt, mal auch im
Internet zu existieren. Das machen wir jetzt. Theater zugänglich
machen, kostenlos, von überall, global sogar. Im Internet eine
neue Kunstform schaffen, die digitalisierte Welt mitgestalten. Das
hier ist eine Initiative der Generation Z.","Ihr! Die Menschen, die sich im Internet bewegen. Unsere Stücke
behandeln das auch. Wir reden von Menschen aus der Gegenwart bzw.
suchen die zeitgemäßen Themen aus klassischen Stoffen und bringen
sie in aktuelle Verhältnisse. Die Zielgruppe ist das Publikum, das
sich mit der Welt des Internets auseinandersetzen will oder darin
nach Erlebnissen sucht.",Saladin Dellers Caspar Weimann
0,Journalismus,"Wie kann es uns gelingen, uns selbst und den kommenden Generationen eine lebenswerte Zukunft auf unserem Planeten zu gewährleisten? Für diese Frage gibt es unzählige verschiedene Lösungsansätze, doch eine Ansicht haben fast alle gemeinsam: Die Zeit drängt! Wir wollen mit dem Umgedacht-Magazin die verschiedenen Ansätze und Ideen zur Lösung der großen ökologischen, sozialen und wirtschaftlichen Fragen unserer Zeit vorstellen und somit zum Umdenken und zum Handeln anregen.",Umgedacht,Oldenburg,3.000 €,,"Nachhaltigkeit, Magazin, Zukunft, Umwelt","Klimawandel, zunehmende soziale Ungleichheiten und ein
Ressourcenverbrauch, der unsere Erde bis in das Innerste
""auszuhöhlen"" scheint, sind nur einige Beispiele für die
Herausforderungen, vor denen die Menschheit heute steht. Angesichts
der Größenordnung dieser Probleme liegt es nahe, schnell zu
resignieren und sich mit der Unbedeutsamkeit der oder des Einzelnen
elegant aus der Affäre zu ziehen.","Das Ziel unseres Projektes ist, durch die Herausgabe eines
kostenlosen Print-Magazins und eines starken Online-Auftritts
möglichst viele Menschen dazu zu bewegen, sich mit den Themen, die
wir für wichtig halten, auseinanderzusetzen. Durch das kostenlose
Print-Magazin und einem professionellen Auftritt in den sozialen
Medien wollen wir insbesondere auch Menschen erreichen, die sich
noch nicht tiefergehend mit dem Thema Nachhaltigkeit und seinen
unzähligen Ausprägungen beschäftigt haben. Hierbei geht es uns
nicht darum, Forschungsarbeit zu leisten oder neue Erkenntnisse zu
gewinnen. Vielmehr wollen wir den bisherigen Erkenntnissen eine
größere Öffentlichkeit verschaffen.",Philipp Bothe Insa Schäfer Sophie Mayer Annalena Laurich Samuel Leon Knaus Lisa Walz Paul Rösler
