0,Design,"Kombiniere deine Sammelwiese. Vier Viertel – ein Kreis. Die innovative Form der Picknickdecke ermöglicht es, sich endlich komfortabel und kommunikativ in eine Runde zu setzen. Moderne Farben und hochwertige Stoffe bieten die optimale Grundlage für ein gemütliches Zusammensein im Grünen. Clever zusammengefaltet wird die Sammelwiese zu einer Umhängetasche für deine wichtigsten Alltagsgegenstände. // Sammelwiese – das Wir genießen.",Felix Angermeyer,Köln,30.000 €,,"Picknick, Decke, Community, outdoor, Sammelwiese","Es geht um dich im Kreise netter Menschen, um Gemütlichkeit in
der Sonne, um Komfort an der frischen Luft.","Schluss mit ungemütlichem und unkommunikativen Sitzen auf einer
rechteckigen Picknickdecke!",Felix Angermeyer
0,Theater,"Die Performance D A M R - dreams are my reality taucht ein in die flüchtige Welt der Träume. Collagenartig mischen sich Sprache, Bewegung, Klänge und Projektionen zu surrealen Traumbildern. Dabei werden sowohl die Performer als auch das Publikum Teil einer abgründigen Traum-Reanimierung. | | Eine Produktion von PFAFT in Zusammenarbeit mit Werkstattmacher e.V. und LOFFT - DAS THEATER. Gefördert von der Stadt Leipzig, Kulturamt. | | Premiere: 29. Mai 2017, weitere Vorstellungen: 30./31. Mai 2017",PFAFT,Leipzig,600 €,,"Träume, Sound, Video, Theater, Performance","Im Schlaf widerfahren uns Dinge, die unseren gewohnten
Erfahrungshorizont überschreiten und sich dabei jeglicher
Kontrolle entziehen.","Besonders reizvoll an diesem Thema finden wir das große
kreative Potential, das sich dahinter verbirgt. Es eröffnet uns
die Möglichkeit, mit verschiedensten performativen
Darstellungsformen zu experimentieren, herkömmliche
Erzählstrukturen zu hinterfragen und bewusst aufzubrechen.",Maxie Pfannkuchen
0,Musik,"Wir sind die Thrash Metal Band ""GumoManiacs"" aus Regensburg und nachdem die letzten Jahre für uns die Hölle waren, brauchen wir jetzt für unser neues Doppelalbum ""By Endurance We Conquer - Demons & Damnation"" eure Hilfe! Durch eure Vorbestellungen bezahlen wir die Pressung für die Doppel-CDs/Doppel-LPs. Erreichen wir das Ziel von 5000€ nicht, geht euer Geld wieder zu 100% an euch zurück und das Album wird Ende 2017 nur digital veröffentlicht.",GumoManiacs,Regensburg,5.000 €,,"GumoManiacs, thrash metal, Metal Band, Album, Vinyl Production",Es geht um die ,"Als professionelle Musiker und leidenschaftliche
Metal-Enthusiasten ist es uns vor allem wichtig, ein erstklassiges,
qualitativ hochwertiges Kunstwerk in Form eines Musik-Produkts zu
schaffen, welches, sowohl auf CD als auch auf Vinyl,
gleichgesinnten ",Gumo Maniacs
0,Mode,"Greta Andersson ist ein nachhaltiges Modelabel für selbstbewusste Frauen. 
Wir verbinden Mode mit Umweltbewusstsein und setzen dabei auf Qualität. Greta Andersson designed casual officewear, die unter fairen Bedingungen entstanden ist und voll ökologisch gewonnen und abgebaut wird. Wir schätzen unsere Umwelt und die Arbeit, die hinter der Mode steckt. 
 Jedes Kleidungsstück hat seine eigene Geschichte, die wir transparent auf  www.GretaAndersson.com  vorstellen.",Christina Barkmann,Hamburg,35.000 €,45.000 €,"fairer Handel, sustainable fashion, Nachhaltige Mode","Wir designen unserer Mode mit dem Anspruch aus jedem Teil ein
Lieblingsstück werden zu lassen. Dabei ist uns wichtig, dass dein
","Greta Andersson kreiert Mode für Frauen, die mitten im Leben
stehen, wissen was sie wollen und wer sie sind. Frauen, die Ihr
Leben mit Leidenschaft leben und dabei Kleidung tragen, die zu
ihnen passt, sich an die Haut anschmiegt und in jeder Hinsicht ein
gutes Gefühl hinterlässt.",Christina Barkmann
0,Bildung,"2016 haben wir unseren Traum verwirklicht: Nach drei Jahren ehrenamtlicher Arbeit wurde in Bielefeld die Montessori-Schule eröffnet. Im August sind wir mit einer altersgemischten Klasse gestartet. Diesen Sommer freuen wir uns, eine neue Klasse mit zwanzig SchülerInnen zu begrüßen. 
Unser Leitsatz: „Nicht das Kind soll sich der Umgebung anpassen, sondern wir sollten die Umgebung dem Kind anpassen"". Um der neuen Klasse eine lerngerechte Umgebung zu bieten, benötigen wir Möbel.",AK Schule,Bielefeld,3.000 €,,"Reformpädagogik, Inklusion, Kinder, Montessori, Schule","Aufgrund des Neustarts besitzen wir noch keine Möbel. Die
Stühle und Tische für die jetzige Klasse haben wir von einer
Grundschule gespendet bekommen. Im nächsten Schuljahr werden wir
erneut auf Spenden für Möbel angewiesen sein, weil die
Erstausstattung in der Verantwortung des Trägers liegt. Danke,
dass Sie uns dabei unterstützen, die neue Klasse gebührend
willkommen zu heißen.","Die Zielgruppe sind Kinder im Alter von 6-9 Jahren mit und ohne
Handicap und das Ziel ist es, Unterricht in einem möblierten Raum
durchführen zu können.",Daniela Osthus
0,Musik,"Die Sonaten und Partiten für Violine von Johann Sebastian Bach sind vielen bekannt. Die Mandoline kennen jedoch nur wenige. 
Hilf mir dabei Bach und die Mandoline auf einer CD zu vereinen.",Florian Klaus Rumpf,Hamburg,8.000 €,,"Bach, Mandoline, CD, 6 Soli, Sonaten und Partiten",Es soll die ,Sagenhafte Kompositionen von Johann Sebastian Bach,Florian Klaus Rumpf
0,Umwelt,"Der Funpark Kavros kümmert sich um verwahrloste und nicht mehr gewollte Tiere, päppelt sie wieder auf und versucht sie in ein Für-Immer-Zuhause zu vermitteln. Durch groß angelegte Kastrationsaktionen verhindern sie zudem noch die weitere Vermehrung der Streuner und tragen so enorm zum Tierschutz bei.",Desiré Goltz,Leutkirch im Allgäu,500 €,,"Katze, Hund, Kreta, Tiere, Tierschutz",Tierschutz ist das große Ziel der gesamten Aktion.,"Ziele sind der Umbau der Gehege und Flächenvergrößerung.
Zudem braucht man dringend einen Sichtschutz zum benachbarten Haus
und vor allem im Katzengehege einen besseren Boden, der isoliert
und zugleich ausbruchsicher ist.",Desiré Goltz
0,Community,"Der Hund ist der beste Freund des Menschen. Kein Wunder, dass es in Deutschland 9 Millionen Hundebesitzer gibt. Mit Dogsharing Deutschland soll nun die größte Community für Hundebesitzer und -freunde geschaffen werden, in der sich die Mitglieder verabreden und gegenseitig helfen können.",Dogsharing Deutschland,Berlin,10.000 €,15.000 €,"Hundesharing, Dogsharing, Hundesitting, Hundebetreuung, Tierbetreuung","Kurz gesagt geht es darum, Hundefreunde und Vierbeiner
deutschlandweit zusammen zu bringen. Es steckt jedoch mehr dahinter
als nur eine Gemeinschaft in der man gegenseitig auf Hunde
aufpasst.","Bei unserem Projekt steht ganz klar der Hund an erster Stelle.
Wegen Arbeit, Urlaub, Krankenhausaufenthalten oder anderen
Umständen bekommen die Vierbeiner nicht immer die Aufmerksamkeit,
die sie brauchen. Eines unserer Ziele ist, diese Probleme mithilfe
der Community zu lösen.",Michael Jezela Maximilian Jezela Simon Luczak
0,Food,"Die besonderen Biere aus Sauensiek gibt es zum Mit-Nach-Hause-Nehmen zur Zeit nur in Sauensiek. Das möchten wir gerne ändern und im Jubiläumsjahr 2017 eine kleine Flaschenabfüllung etablieren und mit Partnern aus dem Einzelhandel einen regionalen Vertrieb aufbauen. Dabei ist es nicht das Ziel, die Welt zu erobern, sondern den Genießern in der direkten Region den Bezug unserer Biere zu vereinfachen. Für alle von weiter weg soll ein kleiner Online-Shop die Versorgung ermöglichen.",First Sight,Sauensiek,15.000 €,,"bier, regional, Vertrieb, Brauerei, Craft Beer","Seit 2007 gibt es (wieder) eine kleine Brauerei in Klindworths
Gasthof in Sauensiek. Handgemachte besondere Biere vom Pils über
Stout bis zu saisonalen Spezialitäten treffen dort seitdem die
Geschmäcker der Gäste aus der Region. Leider erhält man die
Biere zum Mit-Nach-Hause-Nehmen zur Zeit nur in Sauensiek. Das
möchten wir gerne ändern. Daher planen wir im Jubiläumsjahr
2017, eine kleine Flaschenabfüllung zu etablieren und mit Partnern
aus Gastronomie und Einzelhandel einen regionalen Vertrieb
aufzubauen. Wir wollen nicht das ferne Berlin erobern oder die
Bier-Boutiquen der Schweiz dominieren, sondern möchten in den
Kreisen Stade, Rotenburg und Harburg präsenter sein. Ist das Bier
aber erst einmal in Flaschen und im Fass, steht einem Versand auch
nichts mehr im Wege.","Ziel des Projektes ist der Aufbau einer kleinen
Flaschenabfüllung für das Sauensieker Bier und der Aufbau eines
sehr regionalen Vertriebes mit Partnern aus Einzelhandel und
Gastronomie. Zielgruppe sind Bierliebhaber und Gastronomen aus der
Region (oder natürlich auch Durchreisende), die die geschmackliche
Abwechslung regionaler Produkte schätzen.",Nikolaus Klindworth Markus Klindworth
0,Community,"In meinem Elterncafe sollen sich Eltern mit ihren Kindern in entspannter und gemütlicher Umgebung treffen können. Die kleinen können sich in einem Spielbereich austoben, die Eltern können sich unterhalten und was trinken und eventuell in einer kleinen Flohmarktecke noch das ein oder andere Schnäppchen ergattern. Vor allem aber kann man sich bei mir mit mehreren Eltern und deren Kindern treffen und es ist genug Platz für alle!",Anne Aschmann,Steinkirchen,3.000 €,,"Steinkirchen, Baby, Eltern, Babytreff, Kinder","Eltern mit anderen Eltern wieder mehr zusammen zu bringen und
damit auch wieder ein größeres Gemeinschaftsgefühl zu bekommen.
Es soll nicht jeder mit seinem Baby/Kind gerade im ersten Jahr
immer nur zu Hause sitzen müssen, weil es sonst die
Räumlichkeiten nicht hergeben. Einfach mehr miteinander und vor
allem miteinander mit Babys.",Neues Gemeinschaftsgefühl,Anne Aschmann
0,Film  Video,"""Nina Fußball Girl"" ist eine abendfüllende Tragikomödie mit einem Hauch Magie. Ein Film über Ämterirrsinn, Fußball und Alltagshexerei. Eine Mischung aus klassischem Autoren- und Genrefilm über die privaten und bürokratischen Fallstricke der häuslichen Pflege. Für alle, die Filme lieben, die sich nicht in eine Schublade stecken lassen. Unabhängig produziert. Made in Hamburg. Mit eurer Hilfe!",Tim Ungermann,Hamburg,5.000 €,,"Tragikomödie, Spielfilm, Hamburg, Pflege, Fußball","
Wir erzählen die Geschichte der Nachwuchsfußballerin Nina, die
nach einigen Schicksalsschlägen ihre Karriere aufgeben muss. Als
Nina nach 10 Jahren Funkstille plötzlich von ihrem Vater hört,
fällt sie aus allen Wolken.","Wir wollen einen Film auf die Beine stellen, der sich auf
unterhaltsame Weise und dennoch mit ernstem Blick dem Thema
""Häusliche Pflege"" widmet.",Tim Ungermann
0,Social Business,"Ein nettes Wort, eine nette Geste können den ganzen Tag verändern – und diese feine Auswahl an Komplimenten hilft da sofort: hübsch verpackt in einer ansprechenden Geschenktüte finden sich unsere Lose mit 24 verschiedenen, wunderbaren Komplimenten. 
Das Produkt ist im deutschsprachigen Raum schon äußerst beliebt – und nun wollen wir die Welt damit erobern. Für die Produktion in englischer und französischer Sprache, sowie für den internationalen Vertrieb benötigen wir aber noch eine Starthilfe.",Thorsten Rheindorf,Berlin,10.000 €,15.000 €,"Geschenk, Hochzeit, International, retro, Liebe","Fishing for compliments - diese Redensart haben wir
sprichwörtlich in die Tat umgesetzt: einfach ein Los aus dem
Beutel fischen, aufreißen und genießen.","Unsere Zielgruppe: jeder! Vor allem aber natürlich Frauen, die
gern umworben werden. Ebenso aber helfen unsere Komplimente bei
schlechter Laune nach einem stressigen Arbeitstag oder wenn's
gerade nicht so recht läuft.",Thorsten Rheindorf
0,Theater,"SIE ist ein Stück aus dem Nachlass des französischen Dramatikers Jean Genet und wurde bisher nur einmal im deutschsprachigen Raum inszeniert. Anlässlich des Leipziger Kirchentages auf dem Weg 2017 bringen wir dieses Verwirrspiel um Bilder und Abbilder formverliebt auf die Bühne. 
 Premiere : 26. Mai 2017, 20 Uhr, Werk zwei (Halle D) Leipzig 
 Weitere Aufführungen: 
- 27. Mai 2017, 15 Uhr, Werk zwei (Halle D) Leipzig; 24.-27. August 2017, naTo Leipzig",'Sie',Leipzig,1.000 €,,"Jean Genet, Theater, Cammerspiele, SIE, Olav Amende",DER PAPST SPIELT DEN MENSCH,"Gläubige, Ungläubige, Theaterfreunde und -feinde, Leseratten,
Kostümfans und Skeptiker*innen. Nichtsattseher*innen, Alltags- und
Hobbyphilosoph*innen, Kirchenkritiker*innen und Kirchengeher*innen
kurzum: Alle, die Lust auf ein paar Stunden zwischen Schein und
Sein haben.",Miriam Herdt Olav Amende
0,Mode,"Ökologisch handeln ist dir wichtig. Mir auch. Mit dem TENCELGARN kannst du deine liebevoll gefertigten Strickstücke noch ein bisschen nachhaltiger gestalten. Bisher wurden aus dem Garn Pullover, Cardigans, Tücher, Amigurumis, Babyspielzeug und Decken gestrickt und gehäkelt. Welches Projekt planst du?",Marlin Oeing,Hamburg,15.000 €,,"öko, nachhaltig, vegan, häkeln, stricken","Ein Garn aus Holz. Nachhaltig produziert. In 14 verschiedenen
Farben.","
Das TENCELGARN produzieren lassen.",Marlin Oeing
0,Community,"Hier sind wir. 
Hier setzen wir uns ein. 
Für Anteilnahme. 
Für Wertschätzung. 
Für echte Begegnung, die hinter die Fassade schaut. 
Für Hoffnung, die sich auch schweren Umständen widersetzt. 
Für den Raum, im Glauben zu wachsen. 
 Hier im Laden - dem Treffpunkt KirchenCenter",Team Treffpunkt KirchenCenter,Hamburg,8.800 €,12.500 €,"Integration, International, Church, Community","Mitten in einem Einkaufszentrum wurde ein Ort der Begegnung
geschaffen, eine Ladenzeile in einen sozialen Treffpunkt
verwandelt. Wir bieten hier niedrigschwellige Angeboten für die
Kinder und Erwachsenen aus dem Stadtteil.",Wir wollen:,Miriam Qaiyum Alim Qaiyum Jim Whitear
0,Food,"Die vegane Villager's Mango, 'ne VANGO! 
 Gegen Ausbeutung - für fairen Handel 
 100% leckere Mango, ohne jeden Schnickschnack. Eine Vitamin- & Mineralstoffquelle, die Dich durch viele Ballaststoffe lange satt macht und kaum Fett enthält. 
 Unsere VANGOs stammen aus dem Dorcas Center, einem Kinderhilfsprojekt in Afrika und werden in Berlin von den Mosaik Werkstätten für Behinderte fairpackt. 
So stärken wir die Regionalität und fördern faire Arbeitsbedingungen - in Burkina Faso & bei uns",NussundFrucht,Füssen,15.000 €,25.000 €,"Mangos mit Gesicht, gesunder Snack, faire Mangos schmecken besser, getrocknete Mango, fairer Handel","Wir importieren getrocknete Mangostreifen aus dem Herzen
Westafrikas und holen sie einmal im Jahr auf dem Seeweg per
Container nach Deutschland. Wir bieten drei verschiedene
superleckere Sorten, die von honigsüß bis sauer reichen. Dabei
handelt es sich um den puren Geschmack der verschiedenen
Mangosorten. Die Mangos sind unbehandelt, fair gehandelt,
unterstützen ein Hilfsprojekt in Afrika und werden von den Mosaik
Werkstätten für Behinderte fairpackt.",,Laura Drösel Nico Krebs
0,Musik,"CD und Songbook mit 13 Songs. 10 Songs mit spirituellem Hintergrund, 3 Bonussongs aus der ""Vor-Kirchenpop-Phase"". 
Songbook enthält 13 Leadsheets (Text, Melodie, Akkorde). 
8 Songs zusätzlich mit 3-4 stimmigen Chorsätzen, für Bands, Chöre, etc. 
Die Hälfte der CD-Aufnahmen sind mit Band eingespielt, die andere Hälfte, so wie sie live gespielt werden. 
Da auch der Benefizsong für swisscross dabei ist, werden pro verkaufter CD 2 Euro an  www.swisscross.help  gespendet",Alexandra Forster,Konstanz,2.300 €,,"CD, songbook, Songbuch, Kirchenpop, Neues geistliches Lied","""Wer erfand die Liebe"" ist der Titel eines Songs und ebenfalls
von CD und Songbook. Seit ca. 3 Jahren komponiere ich
Kirchenpopsongs. Ich nenne sie so, denn es sollen moderne,
zeitgemäße Lieder sein. Stilistisch eine Mischung aus
Singer-Songwriter und Pop. Es gibt Menschen die sagen die Lieder
würden etwas ""Udo-Jürgeln"". :-) Da ich nun eine kleine Auswahl an
Songs zusammen habe und immer wieder nach CD und Noten gefragt
werde, freut es mich nun, dass ich mit Hilfe von startnext diese
Idee realisieren kann.","Zielgruppe sind eigentlich alle Menschen, die gerne Musik mit
""Tiefgang"" hören. Die Noten sind so angelegt, dass sie einstimmig
und mehrstimmig gesungen werden können und deshalb auch für
Kirchenmusiker interessant, die Lust haben auf ""andere"" Musik mit
ihren Chören, oder einer Band.",Alexandra Forster
0,Musik,"Chamäleon, Christopher Schmidt und Hans Lietz, ein lustiges Akustik-Duo aus Moers. Musikalisch geht's in eine bluesige Richtung aus Rock/Folk und Pop. Spontanität, Lust an der Musik und eine dicke Freundschaft zeichnet uns als Band aus – etwas, das man in der Musik merkt. Es wird viel gelacht, ausprobiert, herumexperimentiert – und jetzt soll das erste Album produziert werden. Helft uns!",Chamäleon,Moers,3.500 €,,"Moers, Chamäleon, Akustik, Album, Rock","Seit 2010 gibt es die Band bereits - jetzt soll endlich das
erste Album her. Die Songs sind geschrieben, wir sind motiviert und
proben, was das Zeug hält - das Studio kann kommen! Noch in diesem
Jahr wollen wir die fertige CD in den Händen halten. Ein großer
Berg Arbeit, und wir können es garnicht erwarten, ihn endlich zu
besteigen. Dafür fehlt uns allerdings das, was den meisten Leuten
fehlt, wenn sie etwas machen wollen: Die Knete! Aber die habt ja
ihr zum Glück. Jeder ein bisschen. So kann aus unserem Traum dann
Realität werden und endlich das fertige Album!","Das Album ist das Ziel! Die Zielgruppe natürlich jeder, der
unsere Musik mag und es sich wünschen würde, die nicht nur auf
Konzerten, sondern auch sonst immer und überall hören zu
können.",Hans Lietz Christopher Schmidt
0,Mode,"Trettl-Cosmetics ist vegan, rein und unverfälscht. 
Eine VEGANE Naturkosmetikserie, in welcher zu größtmöglichen Anteilen Rohstoffe aus pflanzlichem Ursprung Verwendung finden. 
Klingt einfach – ist es aber nicht! 
Nach über 2 Jahren Entwicklungsphase sind wir sehr glücklich, jetzt ein einwandfreies Produkt präsentieren zu können.",Daniela Trettl Beck,Bad Reichenhall,5.000 €,,"Pure Reinheit, Naturkosmetik, ohne Erdöl, ohne Tierversuche, vegane Kosmetik","Wer selbst manche Kosmetikprodukte nicht mehr verträgt, wer
für sein Hotel oder Kosmetikstudio auf der Suche nach innovativen
Produkten ist, wer der entfremdeten Schönheitsindustrie ein
Schnippchen schlagen will oder wer an die Kraft einer einfachen
Idee glaubt, der wird am Erfolg dieser Marke seine Freude
haben.","Unser Ziel ist es, dass die Badezimmerschränke wieder etwas
leerer werden. Dass nur noch Produkte dort sind, die rein,
natürlich und gut verträglich sind. Kosmetik, die Spaß macht und
von Männern genau so gut verwendet werden kann wie von Frauen.
Menschen ab 35, denen es wichtig ist, was sie an ihre Haut
lassen.",Daniela Trettl Beck
0,Kunst,"Wir möchten Fechenheim in der Weihnachtszeit stimmungsvoll illuminieren. Unser Stadtteil ist das östliche Eingangstor der Stadt Frankfurt am Main und bietet mit seiner idyllischen Lage und den historischen Fachwerk- und Gründerzeithäusern einen gemütlichen Altstadtkern. Gemeinsam mit Ihnen und dem Wirtschaftsdezernat Frankfurt werden wir eine neue Weihnachtsbeleuchtung für unseren geliebten Stadtteil installieren, um diesen attraktiver und lebendiger zu gestalten.",Vorstand des Gewerbevereins e.V.,Frankfurt am Main,3.500 €,10.000 €,"Fechenheim, Frankfurt am Main, Engagement, Kunst & Kultur, Illumination","Der Frankfurter Stadtteil Fechenheim hat die einmalige
Möglichkeit, in Zusammenarbeit mit dem Wirtschaftsdezernat der
Stadt Frankfurt eine neue Weihnachtsbeleuchtung zu installieren.
Die bestehende ist in keinem guten Zustand und hat einen hohen
Stromverbrauch.","Unser Ziel ist die erfolgreiche Realisierung einer neuen
Weihnachtsbeleuchtung für Fechenheim. Dieses Projekt kommt der
Allgemeinheit zu Gute und schafft eine besondere Atmosphäre in der
Weihnachtszeit. Wir möchten den Stadtteil aufwerten und in der
dunklen Weihnachtszeit die Sicherheit durch Licht erhöhen. So
stärken wir das Image des Stadtteils und schaffen
Kulturprojekte.",Sebastian Schugar
0,Musik,"Wir sind Marie Adamowicz & Peter Dobbeck und musizieren Pop-Musik mit deutschen Texten. Endlich veröffentlichen wir unsere Debut-CD 'Fragen an die Welt', auf die einige von Euch schon lange gewartet haben. Unsere Songs haben wir bereits mit viel Liebe zum Detail arrangiert und aufgenommen. Jetzt müssen sie nur noch gemastert und auf CD gepresst werden. 
Mit Eurer Hilfe können wir dieses Projekt realisieren und wir freuen uns über jede Unterstützung.  
www.wirsindmusik.com",Marie-Laurence Adamowicz,Hamburg,3.000 €,,"Familien-Musik, Wirsindmusik.com, CD, Musik, Deutsch-Pop",WIR SiND MUSIK!,"Unsere Musik ist nicht nur für Kinder - aber auch! Sie ist für
alle, die gerne in Ihrem Leben von Musik begleitet werden, zum
Tanzen, zum Melancholieren, zum Mitsingen, zum Zuhören und zum
Träumen. Weiter unten oder auf der Soundcloud-Seite findet Ihr
Hörbeispiele.",Marie-Laurence Adamowicz
0,Community,"BIKE PARKING ist mehr als ein Fahrradparkplatz - wir bieten Schutz vor Vandalismus, Diebstahl, Zerstörung. Kostenlos. 
 Der Fahrradparkplatz ist eingezäunt - du erhälst eine Marke zu deiner Sicherheit - wer bei Abholung dem BIKE PARKING Personal keine Marke vorweisen kann, erhält keinen Zutritt! 
 Wir bieten dir weitere Services: Schließfächer für alles, was wichtig und wertvoll ist sowie Power Banks zum Aufladen deines Handys",Stefan Thaufelder,Berlin,2.400 €,,"Event, Fahrradsicherheit, Fahrradparken, Fahrrad, Fahrradanreise","Bei großen Veranstaltungen wissen viele Fahrradfahrer nicht, wo
sie ihr Fahrrad abstellen können - sicher und geschützt vor
Vandalismus, Diebstahl und Zerstörung.","Ob Familienevent oder Open Air Konzert - mit zunehmendem
Radverkehr wird es immer wichtiger, auch die passende
Fahrradparklogistik bei großen Veranstaltungen bereit zu
halten.",Stefan Thaufelder
0,Theater,"International Feminist Theater of the Oppressed Festival ""No Means No"" in Berlin Germany, hosted by Madalena-Berlin.",Madalena Berlin,Berlin,5.000 €,,"theater of the oppressed, Festival, Feminist Festival, NO means NO, Ma(g)dalena international Network","
Did you hear something about it?","Over the past year, the group Madalena-Berlin have launched a
Legislative Theatre campaign “NO means NO,” to create
legislative change in regards to sexual violence, rape, and abuse.
In this context, Madalena-Berlin has the great pleasure to inform
the world: II Ma(g)dalena International Festival - “NO means
NO” ""Ending violence against women!” 13th to 17th of September
2017 - Berlin, Germany.",Bárbara Santos
0,Sport,"Drop and Ride ist ein neu gegründeter Verein in Kabul, Afghanistan. Der Name leitet sich von dem Weglegen der Waffe (Drop) und dem Fahrrad fahren als Alternative (Ride) her. Drop and Ride ist aus der Eigeninitiative einer Jugendgruppe entstanden, welche sich das Ziel gesteckt hat, einen Fahrrad-Verein zu schaffen und dabei auch soziale Problematiken über den Sport zu thematisieren. Wir wollen sie dabei unterstützen und ihnen mit Deiner Hilfe das fehlende Equipment zur Verfügung stellen!",Drop and Ride,Kabul,5.000 €,,"Kabul, Afghanistan, Mountainbike, Fahrrad, Drop and Ride",Das Projekt in Afghanistan trägt den Namen ,"Unser aktuelles Ziel ist die Sammlung von passendem und
hochwertigem Equipment (BMX-Bikes, Mountainbikes,
Schutzausrüstung, Werkzeug für eine Fahrradwerkstatt) durch
Spenden von Firmen aus der Fahrradbranche in Europa. Zu den ersten
Sponsoren des Projektes zählen TSG (Helme), Dakine (Kleidung) und
Five Ten (Schuhe). In Afghanistan ist die benötigte Art von
geeigneter Ausrüstung und Fahrrädern nur sehr schwer und in
schlechter Qualität zu beschaffen.",Moritz Kistenfeger Ramon Hunziker
0,Literatur,"Die 2te Auflage eines in Leder gebundenen Buches, gefüllt mit Texten und Theorien über Magie und Zauberei. Zusammengestellt, selbstgeschrieben und inspiriert durch vielerlei Texte, Geschichten und Regelwerke. Von Runenkunde über Weltentheorie und Elementarmagie bis hin zu expliziten Zauberthesen. Hier ist alles dabei. Das Werk umfasst mehr als 400 Seiten und ist mit zusätzlichen Bildern von Melanie Phantagrafie illustriert.",Dominik Fröhlich,Mülheim an der Ruhr,2.000 €,,"Fantasie, Theorie, Larp, Magie, Buch","Die Wege der Magie sind unergründlich. Was nicht bedeutet, dass
man diese nicht aufzeigen kann. Letztendlich muss jeder seinen Weg
finden.","Neben den Updates welche ich im Blog gemacht habe möchte ich hier die Leseprobe einmal aktualisieren und erweitern. Die Texte sind, wie zuvor, zufällig aus dem Buch entnommen. Diese Texte sind nun Final, sowohl was das Layout, als auch den Text selbst angeht.",Dominik Fröhlich
